2.44604,41.68950,"SEM  LLUI Sta M. Palautordera Ronda Sur DIR Noreste" -2.68222,42.84740,"SEM A300 Adriano VI 15 DIR Centro" -3.69291,40.34173,"SEM A300 Av Andalucía Metro San Cristóbal DIR Sur" -0.12332,38.54149,"SEM A300 Av Cdad Valenciana CRUCE Orts Llorca DIR Este" -3.55737,40.42740,"SEM A300 Av Constitución CRUCE Buenos Aires DIR Este" -3.55601,40.42719,"SEM A300 Av Constitución CRUCE Buenos Aires DIR Oeste" -0.17753,38.96829,"SEM A300 Av del Grau 10 DIR Norte" -16.29240,28.46929,"SEM A300 Av Los Menceyes 242 DIR Sta Cruz" -0.54927,42.56604,"SEM A300 Av Perimetral 18 DIR Este" -5.84124,43.36632,"SEM A300 Entrada A-66 Pl Cruz Roja DIR Centro" -5.67528,43.52775,"SEM A300 Gaspar Laviana 4 DIR Cementerio" -5.84252,43.36597,"SEM A300 General Elorza 18 DIR Salida" -4.71859,41.63612,"SEM A300 Juan Carlos I 3 DIR Av Soria" 2.76348,42.12002,"SEM A300 Llibertat 72 DIR Norte" -0.18310,38.97029,"SEM A300 San Rafael 60 DIR Norte" -4.53632,42.00841,"SEM ABEL Av Castilla 55 DIR Noroeste" -8.76594,42.60360,"SEM ABRG Rosalía Castro 54 DIR Centro" -8.53354,42.88460,"SEM ABRG Rotonda Concheiros DIR Av Lugo" -8.53592,42.88929,"SEM ABRG San Caetano N. DIR SW" 1.50473,42.49835,"SEM ALIC Av Enclar N 10 DIR NE" -4.52385,41.99848,"SEM ALIC Av San Telmo N DIR SSE" -5.73153,37.58981,"SEM ALIC Av Sevilla N 21 DIR W" 1.50702,42.49946,"SEM ALIC Av Sta Coloma N 120 DIR SW" 2.03422,41.56636,"SEM ALIC Av Vallés 120 DIR S" 2.22619,41.52599,"SEM ALIC BV-5001 Km DIR A" 2.29327,41.62281,"SEM ALIC C-352 Km DIR W" -0.53136,38.40021,"SEM ALIC Crtra Elda N 34 DIR SE" 2.17357,41.39296,"SEM ALIC Girona N 41 DIR NW" -5.73249,37.60588,"SEM ALIC Gran Avenida N 47 DIR SSE" -3.17853,40.64379,"SEM ALIC Isidoro Montalvo N DIR A" -8.86511,42.48532,"SEM ALIC Juan XIII N. DIR S" -5.57215,42.60921,"SEM ALIC Mariano A N 57 DIR N" 2.29536,41.62984,"SEM ALIC N-152a N. DIR N" 2.29552,41.63027,"SEM ALIC N-152a N. DIR S" -3.35753,38.99598,"SEM ALIC N-430a Km DIR NE" -4.08909,40.67231,"SEM ALIC N-Via N DIR SE" 2.29314,41.62272,"SEM ALIC Pont N. 17 DIR E" 2.44801,41.69133,"SEM ALIC Ramon y Cajal N 13 DIR NE" 2.44959,41.69231,"SEM ALIC Ramon y Cajal N 39 DIR NE" 2.16571,41.62965,"SEM ALIC Sta Teresa DIR NE" -8.86153,42.48378,"SEM ALIC Tte. Dominguez N. 102 DIR SSW" -3.69296,40.35073,"SEM ANCH Av Andalucía CRUCE Alcocer DIR Norte" -3.69335,40.36059,"SEM ANCH Av Andalucía CRUCE Unanimidad DIR Norte" -5.40405,41.98788,"SEM APZA N-610 Km 81.0 DIR Suroeste" -5.40982,41.98753,"SEM APZA N-610 Km 81.5 DIR Este" 0.00765,38.84287,"SEM ARCH Av Alacant N 3 DIR N" 0.00766,38.84347,"SEM ARCH Av Constitucio N 46 DIR S" -5.77225,43.25007,"SEM ARIA Manuel Llaneza N 2 DIR E" -2.68763,42.85289,"SEM BACA México 11 DIR Sur" -3.60844,40.54381,"SEM BAND Acceso A-1 Km 18.4 DIR Sur" -3.71281,40.60047,"SEM BAND Av Encuartes 9 DIR Centro" -3.71371,40.48329,"SEM BAND Cardenal Herrera Oria 204 DIR Suroeste" -3.64290,40.54460,"SEM BAND Marqués Valdavia 88 DIR Noroeste" 2.14396,41.39043,"SEM BCN9 Av Sarriá 24 DIR W" 2.0281,41.34704,"SEM BCN9 Rda St Ramon DIR S" -2.17376,43.05749,"SEM BERA Filipinas 24 DIR SW" -5.91469,43.55211,"SEM BERK Marqués Suances 12 DIR Gijón" -3.71116,40.47127,"SEM CAMI Sinesio Delgado 62 DIR Oeste" 2.58109,41.58671,"SEM CBC1 N-II N. 18 DIR NE" -3.68978,40.46219,"SEM CESA Castellana 169 DIR Sur" -3.68120,42.34661,"SEM CHEL c/ Vitoria 109 DIR N-I" -5.85530,43.35597,"SEM CHES Entrada N-630 Pl Castilla DIR Centro" -4.52130,41.36577,"SEM CHYK Av. Fausto Herrero 17 DIR centro" -4.54379,41.35760,"SEM CHYK Av. San Miguel 54 DIR centro" -3.67318,40.43918,"SEM CLF- Av America DIR SW" 2.28447,41.46826,"SEM COCK Camí Rai 73 DIR Mataró" 2.15502,41.39543,"SEM COTA Diagonal 488 DIR Llobregat" -0.39900,39.46871,"SEM CUBE Av del Cid 70 DIR Oeste" -4.52719,42.00159,"SEM CYBE Av Valladolid 15 DIR Sureste" -3.746060,40.363131,"SEM DOBR Av de la Peseta 105 DIR E" -3.745599,40.363456,"SEM DOBR Av de la Peseta 107 DIR W" -3.749607,40.362572,"SEM DOBR Av de la Peseta 91 DIR W" -3.65609,40.422732,"SEM DOBR Av Marques de Corbera DIR SW" -3.19548,40.62975,"SEM DOBR Fco Aritio 128 DIR NNE" -3.54766,40.35680,"SEM DOBR Rivas Avda. de los Almendros 1 DIR noreste" -3.75325,40.30018,"SEM DOCT Manuel Azaña 12 DIR Ambas" -4.78728,37.90726,"SEM DRKC Av Calasancio DIR Ambas" -4.81547,37.88171,"SEM DROM A-431 Km 2.8 DIR Palma del Río" -4.19799,40.71547,"SEM DUKE A-6a San Rafael 1 DIR E" -5.58428,42.58564,"SEM DUKE Dr Fleming DIR S" -4.18031,40.71157,"SEM DUKE N-VI Km 61.1 DIR W" -4.09190,40.67478,"SEM DUKE N-VI N.2 DIR W" -5.58022,42.59598,"SEM DUKE Paseo Salamanca DIR SSE" -1.12946,37.96826,"SEM DUKE Ronda sur N. DIR E" -5.57176,42.59604,"SEM DUKE Sta Nonia N.7 DIR S" -3.78286,40.45235,"SEM EDUA Arroyo de Pozuelo 99 DIR Este" -3.92048,38.98660,"SEM ENON Rda Calatrava DIR S" -3.92855,38.99590,"SEM ENON Rda Carmen DIR E" -3.93253,38.98151,"SEM ENON Rda Ciruela DIR NW" -3.92552,38.98131,"SEM ENON Rda Granada DIR NE" -2.46205,41.76570,"SEM ENTU Cuesta Dehesa Serena 2 DIR Pl Rosario" -2.46250,41.76623,"SEM ENTU Tirso de Molina DIR Zaragoza" -3.67508,40.43522,"SEM FAFI Francisco Silvela 58 DIR Noroeste" -5.99302,37.40720,"SEM FAFI Torneo-Jiménez Becerril DIR Suroeste" -3.29379,38.03655,"SEM FARR N-322 Km DIR E" -6.98057,38.87264,"SEM FEDO Av Antonio Masa Campos 45 DIR Norte" -3.71739,40.49404,"SEM FERV Ventisquero de la Condesa 42 DIR Noroeste" -4.71206,41.64183,"SEM FLY- Av Soria 5 DIR Centro" 3.13137,41.93779,"SEM FRAN C-66 Llofriu DIR Ambas" -8.87115,41.90128,"SEM GADG A Guarda Concepcion Arenal" 2.17362,41.39294,"SEM GEM- Girona 39 DIR Montaña" -2.68107,42.85050,"SEM GOTX Av Gasteiz 73 DIR Sur" -2.66640,42.84196,"SEM GOTX Pio XII 2 DIR Norte" -2.65934,42.86965,"SEM GOTX Portal Gamarra 20 DIR Centro" -2.67820,42.84939,"SEM GOTX Ramiro Maeztu 20 DIR Norte" -1.94870,43.32130,"SEM GOVI Av José Elósegui 270 DIR Pasajes" -2.00147,43.31513,"SEM GOVI Av Zumalakárregui 3 DIR Ondarreta" -4.02632,39.86948,"SEM GUAI Av Europa DIR NW" -8.69169,43.21141,"SEM IBIZ Fomento 17 DIR Coruña" -4.76578,43.42312,"SEM ICAR Av. La Paz 3 DIR Centro" 2.18085,41.39890,"SEM JAAM Gran Vía Corts Catalanas 743 DIR Besós" -0.39124,39.46876,"SEM JMAR Pérez Galdós 78 DIR Noroeste" -3.70844,40.43882,"SEM JMRM  C/ Cea Bermudez  DIR E" -3.68282,40.44253,"SEM JMRM  C/ Joaquín Costa   En la puerta del Hosp S Fco de Asis" -3.68061,40.40420,"SEM JMRM Av Ciudad de B 29 DIR WNW" -3.45617,40.46396,"SEM JMRM Torrejon Ctra Base Americana 3" -7.56248,43.01230,"SEM JOKE Ronda Muralla 134 DIR Sur" -1.66136,42.80647,"SEM JTXO Pío XII 45 DIR Centro" 2.16588,41.62972,"SEM JUGO C-1413a N. DIR A" -3.91345,40.30359,"SEM KAPE Acceso A-5 Km 23 DIR Este" -0.99320,37.60964,"SEM KAPE Alameda San Antón 21 DIR Sur" -0.17972,38.96850,"SEM KAPE Av Alicante 10 DIR Este" -4.26759,42.79559,"SEM KAPE Av Cervera 34 DIR Centro" -5.85306,43.36709,"SEM KAPE Avda Santander 10 DIR Noreste" 2.18681,41.44394,"SEM KAPE BCN Meridiana 606 DIR Noreste " 2.22680,41.52727,"SEM KAPE BV-5001 Martorelles DIR Suroeste " -3.22041,43.38177,"SEM KAPE Calle de La Ronda 9 DIR Noroeste" -4.31212,41.40138,"SEM KAPE Calle Nueva 6 DIR Sureste" -3.61096,37.17853,"SEM KAPE Camino de Ronda 123 DIR Sureste" 2.22625,41.52741,"SEM KAPE Carrer Barcelona 70 DIR Badalona" 2.22898,41.52461,"SEM KAPE Carrer Girona 57 DIR Mollet" 2.27213,41.46306,"SEM KAPE Carrer Marina 85 DIR Mataró" -8.19941,43.49780,"SEM KAPE Carretera de Castilla 103 DIR Suroeste" -3.08302,38.11799,"SEM KAPE Circunvalación 2 DIR Albacete" -4.32557,41.40464,"SEM KAPE Crtra Valladolid 42 DIR Centro" 2.22849,41.52525,"SEM KAPE Ctra Badalona 18 DIR Badalona" 2.23197,41.63693,"SEM KAPE Ctra. Parets a Bigues con Cami del Gual DIR Sur" 2.23252,41.64112,"SEM KAPE Ctra. Parets a Bigues DIR Norte" 2.23248,41.64128,"SEM KAPE Ctra. Parets a Bigues DIR Sur" 2.22641,41.52688,"SEM KAPE Emili Monturiol 4 DIR Noreste" -4.08888,40.67214,"SEM KAPE Guadarrama Alfonso Senra 16 DIR Villalba" -4.09083,40.67382,"SEM KAPE Guadarrama Alfonso Senra 38 DIR Tablada" -5.97054,37.39358,"SEM KAPE Kansas City 50 DIR Centro" -3.21648,43.37461,"SEM KAPE Leonardo Rucabado 26 DIR Noroeste" 0.61810,41.62148,"SEM KAPE Lleida Avinguda Alcalde Rovira Roure 17 DIR Noroeste" 0.63175,41.61193,"SEM KAPE Lleida Avinguda de les Garrigues 34 DIR Noroeste" 0.62259,41.62039,"SEM KAPE Lleida Avinguda Prat de la Riba 27 DIR Noreste" 0.61789,41.60774,"SEM KAPE Lleida Carrer Cos-Gayón 7 DIR Noroeste" 0.62773,41.62285,"SEM KAPE Lleida Carrer Príncep de Viana 44 DIR Sureste" -3.75977,40.38408,"SEM KAPE Los Poblados 58 DIR Noroeste" -3.73560,40.37388,"SEM KAPE Los Poblados CRUCE Abrantes DIR Oeste" 2.23361,41.52724,"SEM KAPE Martorelles Av. D_en Piera 84 DIR Este" -0.99235,37.60565,"SEM KAPE Menéndez Pelayo 2 DIR Noreste" -0.99261,37.60541,"SEM KAPE Menéndez Pelayo 4 DIR Noreste" -3.67753,40.41475,"SEM KAPE Menéndez Pelayo 63 DIR Sur" -2.52176,41.76614,"SEM KAPE N-122 Km 161.1 DIR Valladolid" -2.52431,41.76499,"SEM KAPE N-122 Km 161.35 DIR Soria" -2.21848,40.10041,"SEM KAPE N-320 Km 147.3 DIR Guadalajara" -2.22399,40.10867,"SEM KAPE N-320 Km 148.3 DIR Albacete" -4.40918,40.77935,"SEM KAPE N-VI Km 83.2 DIR Coruña" -4.41059,40.78095,"SEM KAPE N-VI Km 83.4 DIR Madrid" -0.97444,37.60741,"SEM KAPE Pl. de Alicante DIR Sur" -3.53995,40.35159,"SEM KAPE Rivas José Saramago DIR salida" -0.40964,39.52875,"SEM KAPE Rocafort Carrer Major 2 DIR Sur" -3.60615,37.18119,"SEM KAPE Severo Ochoa DIR Noreste" -0.99345,37.60910,"SEM KAPE Soldado Rosique 1 DIR Este" -5.77830,37.18276,"SEM KAPE Utrera Av San Juan Bosco 2 DIR Noroeste" -2.92942,43.26215,"SEM KOYA Alameda Mazarredo 4 DIR Abando" -2.92903,43.26315,"SEM KOYA Alameda Mazarredo 9 DIR Abando" -2.94583,43.26214,"SEM KOYA Alameda Urquijo 96 DIR San Mamés" -2.94616,43.25819,"SEM KOYA Ferrocarril 4 DIR Ametzola" -2.93564,43.25762,"SEM KOYA General Concha 30 DIR Vistalegre" -2.93649,43.26295,"SEM KOYA Iparraguirre 29 DIR Guggenheim" -3.36443,40.48505,"SEM KX0- Vía Complutense 35 DIR Suroeste" -2.69835,43.38260,"SEM LAGU BI-2235 Km 44.7 DIR Mundaka" -3.70087,40.48928,"SEM LARK Cardenal Herrera Oria 136 DIR Noreste" -8.78713,42.58584,"SEM LAUC Av Vilanova 8 DIR NNE" -3.7499,40.36225,"SEM LCAS Av dl Peseta 92 DIR E" -3.74142,40.36708,"SEM LCAS Crtra Leganés CRUCE Thaler DIR Noreste" -3.71703,40.39711,"SEM LCAS Gral Ricardos 101 DIR NE" -5.69259,43.53917,"SEM LEON Príncipe Asturias 196 DIR A-8" 2.60504,41.61690,"SEM LU20 BV-5128 Km 26" -5.59219,42.60654,"SEM LUPA  San Andrés del Rabanedo Av. San Ignacio de Loyola 50 DIR Noroeste" -3.49773,40.59627,"SEM LUPA Algete calle De las Fraguas 1 DIR Norte" -3.49764,40.59636,"SEM LUPA Algete Plaza de la Constitución DIR Oeste" -6.37858,39.46800,"SEM LUPA Antonio H. A DIR NW" -6.37780,39.46698,"SEM LUPA Antonio H. B DIR SE" -6.97897,38.87101,"SEM LUPA Av Antonio Masa Campos 28 DIR Sureste" -6.33689,38.93029,"SEM LUPA Av Cáceres 104 DIR centro" -6.96555,38.87094,"SEM LUPA BA-20 Km DIR NE" -6.97260,38.86925,"SEM LUPA Badajoz Av. Juan Sebastián Elcano 5 DIR Oeste" -6.96026,38.87282,"SEM LUPA Badajoz calle Santo Cristo de la Paz 92 DIR Noroeste" -0.16219,38.94596,"SEM LUPA Bellreguard Av. Alacant 110 DIR Noroeste" -0.16230,38.94601,"SEM LUPA Bellreguard Av. Alacant 81 DIR Sureste" -6.379057,39.47463,"SEM LUPA Cáceres Av. Hernán Cortés 16 DIR sur" -6.37672,39.479062,"SEM LUPA Cáceres Av. Hernán Cortés 90 DIR noreste" -4.78528,37.91443,"SEM LUPA Córdoba Av. San José de Calasanz 21 DIR Sur" -1.13849,42.12698,"SEM LUPA Ejea de los Caballeros Paseo del Muro 41 DIR Suroeste" 2.81670,41.97579,"SEM LUPA Girona Carrer Barcelona 59 DIR Suroreste " 2.81655,41.97542,"SEM LUPA Girona Carrer Barcelona 63 DIR Noreste " 2.23399,41.52726,"SEM LUPA Martorelles Av. D_en Piera 47 DIR Oeste" -4.53050,42.01231,"SEM LUPA Palencia Av. Casado de Alisal 23 DIR Noroeste" -4.13953,42.99732,"SEM LUPA Reinosa Av. Puente Carlos III 38 DIR Suroeste" -5.59726,42.59838,"SEM LUPA San Andrés del Rabanedo Av. Parroco Pablo Diez 104 DIR oeste" -4.57558,40.29557,"SEM LUPA Sotillo de la Adrada Av. Rodriguez de Miñon DIR Suroeste" -4.59092,40.29382,"SEM LUPA Sotillo de la Adrada Ctra. de la Adrada DIR Este" -16.25677,28.46357,"SEM LUPA Tenerife Av. San Sebastian 85 DIR este" -4.73640,41.67024,"SEM MADI Crtra Fuensaldaña DIR Centro" -4.71844,41.64937,"SEM MADI Don Sancho 11 DIR Renfe" -4.73447,41.64454,"SEM MADI P Zorrilla 44 DIR Salamanca" -4.73037,41.65350,"SEM MADI Pl Poniente 1 DIR Pl Mayor" 2.16531,41.39250,"SEM MAIG Aragón 282 DIR Llobregat" 2.18751,41.40926,"SEM MAIG Aragón 611 DIR Llobregat" 2.14952,41.38060,"SEM MAIG Aragón DIR SW" 2.15176,41.39413,"SEM MAIG Aribau 179 DIR Montaña" 2.15534,41.39141,"SEM MAIG Aribau Roselló DIR NW" 2.15491,41.38548,"SEM MAIG Av Roma 140 DIR Llobregat" 2.11107,41.40895,"SEM MAIG Av Vallvidrera 77 DIR Centro" 1.91035,41.79907,"SEM MAIG B-430 46 DIR Sallent" 2.15436,41.39560,"SEM MAIG Balmes 172 DIR Mar" 2.18999,41.40394,"SEM MAIG Diagonal 203 DIR Este" 2.16953,41.39893,"SEM MAIG Diagonal 329 DIR Besós" 2.15869,41.39633,"SEM MAIG Diagonal 389 DIR Besós" 2.15099,41.39433,"SEM MAIG Diagonal 433 DIR Besós" 2.12853,41.38869,"SEM MAIG Diagonal 662 DIR Llobregat" 2.14121,41.38684,"SEM MAIG Entenza 225 DIR Montaña" 2.16155,41.39308,"SEM MAIG Mallorca 249 DIR Llobregat" 2.16312,41.39426,"SEM MAIG Mallorca 279 DIR Llobregat" 2.15696,41.38848,"SEM MAIG Muntaner 110 DIR Mar" 2.15131,41.39276,"SEM MAIG Muntaner 190 DIR Mar" 2.13778,41.40296,"SEM MAIG Muntaner 495 DIR Mar" 2.15814,41.38758,"SEM MAIG Muntaner 79 DIR Mar" 2.13868,41.38358,"SEM MAIG Numancia 57 DIR Mar" 2.15250,41.39309,"SEM MAIG París 178 DIR Besós" 2.13224,41.39778,"SEM MAIG Vía Augusta 257 DIR Mar" 2.14222,41.39838,"SEM MAIG Vía Augusta DIR NE" -4.73950,41.65020,"SEM MAIJ Av Salamanca 32 DIR Burgos" 0.61961,41.61309,"SEM MANO Lleida Rambla de Arago 15 DIR Suroeste" -4.32966,40.75688,"SEM MELE N-VI Km 75.7 DIR Coruña" -4.33411,40.75895,"SEM MELE N-VI Km 76.1 DIR Madrid" -4.52046,40.84094,"SEM MELE N-VI Km 95.2 DIR Coruña" -4.52298,40.84268,"SEM MELE N-VI Km 95.5 DIR Madrid" 2.17526,41.40681,"SEM MGZR Roselló DIR NE" 2.17453,41.40078,"SEM MGZR Sicilia DIR NW" -5.57443,42.60113,"SEM MINA Av Padre Isla DIR NW" -3.63637,40.40051,"SEM MTLZ Fte Carrantona CRUCE Pavones DIR Noreste" -3.08261,38.11812,"SEM NAVA Circunvalación 15 DIR Úbeda" -3.07996,38.11907,"SEM NAVA Circunvalación 25 DIR Úbeda" -3.62254,39.90314,"SEM OPAL CM-4004 Num 9c DIR E" -3.49839,39.957883,"SEM OPAL N-400 num 1 DIR WSW" -4.08802,43.36399,"SEM OSCA Barrio Pte S. M. 32 DIR S" 2.16106,41.39731,"SEM PABL Pau Claris 192 DIR Mar" 2.16359,41.39712,"SEM PABL Roger de Lluria 120 DIR Montaña" -5.97421,43.55979,"SEM PARA Alcalde J Fernandin DIR S" 2.15991,41.38845,"SEM PARE Aragón 216 DIR Llobregat" 2.16598,41.38680,"SEM PARE Balmes 13 DIR Mar" 2.15477,41.38504,"SEM PARE Conde Urgell 136 DIR Montaña" 2.15897,41.38184,"SEM PARE Conde Urgell 62 DIR Montaña" 2.16020,41.39674,"SEM PARE Diagonal 442 DIR Llobregat" 2.13417,41.39528,"SEM PARE General Mitre 42 DIR Montaña" 2.15260,41.37766,"SEM PARE Gran Vía Corts Catalanas 415 DIR Besós" 2.15943,41.38279,"SEM PARE Gran Vía Corts Catalanas 533 DIR Besós" 2.16287,41.38537,"SEM PARE Gran Vía Corts Catalanas 583 DIR Besós" 2.16773,41.38919,"SEM PARE Gran Vía Corts Catalanas 609 DIR Besós" 2.14374,41.39018,"SEM PARE Josep Tarradellas 118 DIR Francesc Maciá" 2.16849,41.41231,"SEM PARE Padilla 388 DIR Montaña" 2.42207,41.53556,"SEM PARE Ronda Cross 34 DIR Costa" 2.16635,41.41199,"SEM PARE Ronda Guinardo 40 DIR Besós" 2.16038,41.39049,"SEM PARE Valencia 236 DIR Besós" 2.16189,41.39162,"SEM PARE Valencia 252 DIR Besós" -16.25743,28.47137,"SEM PDIS Rambla 96 DIR Noreste" -8.80613,42.14608,"SEM PDXO Av. Val Miñor 37 DIR Sur" -3.76593,40.36967,"SEM PECO Av Peseta DIR NW" 2.21071,41.53419,"SEM PEPE Av Badalona 16 DIR W" 2.21187,41.53386,"SEM PEPE Av Badalona 31 DIR W" 2.18814,41.48760,"SEM PEPE Av dl Ribera N. DIR W" -1.49229,37.77386,"SEM PIOL Alhama 8 " -3.69900,40.38725,"SEM POLL Av Córdoba 5 CRUCE Gta Cádiz DIR Norte" -3.67312,40.40695,"SEM POLL Av Mediterráneo 30 DIR Este" -0.38137,39.46880,"SEM PUNT Guillem Castro 31 DIR Noroeste" 2.21027,41.5343,"SEM RAFE Av Badalona 16 DIR C-17" 2.20797,41.53311,"SEM RALP Av Burgos 82 DIR Centro" -4.75371,41.62353,"SEM RASI Av Zamora DIR SE" 2.44724,41.53694,"SEM RCAR San Antonio 42 DIR SE " -0.35265,39.47483,"SEM RICH Cardenal Benlloch 110 DIR Noreste" 2.00791,41.57009,"SEM ROBS 22 de Julio 265 DIR E" 2.00873,41.57017,"SEM ROBS 22 de Julio 267 DIR E" 2.00859,41.57034,"SEM ROBS 22 de Julio 269 DIR W" -1.61108,39.51340,"SEM ROBS A-3 Km 237 DIR E  STOP" -4.81618,37.88155,"SEM ROBS A-431 Km DIR A" -4.19122,40.71767,"SEM ROBS A-6a San Rafael 2 DIR" -3.62384,40.44174,"SEM ROBS Alcalá con San Romualdo DIR E" -8.54646,42.86797,"SEM ROBS Amor Ruibal 30 DIR N" -3.71523,40.39752,"SEM ROBS Antonio López DIR NW" 2.16222,41.39019,"SEM ROBS Aragón 229 DIR Llobregat" -3.64033,40.43048,"SEM ROBS Ascao con Emilio Ferrari DIR SW" -3.75990,40.23345,"SEM ROBS Av America 21 DIR NNE" -3.76828,40.22674,"SEM ROBS Av America, 49 _ JC-I DIR SW" -0.41212,39.38221,"SEM ROBS Av Levante Beniparell DIR Ambas" -3.82579,40.35288,"SEM ROBS Av Móstoles DIR SW" -3.75712,40.22219,"SEM ROBS Av Planetas DIR SSW" -5.67466,40.97317,"SEM ROBS Av Portugal A DIR E" -3.61423,40.36860,"SEM ROBS Av Puentedey DIR SE" -0.40565,39.40735,"SEM ROBS Av Rambleta 56 Catarroja DIR Ambas" -0.40676,39.40242,"SEM ROBS Av Rambleta Catarroja DIR Ambas" -1.60191,42.81171,"SEM ROBS Av Reino Navarra N. DIR E" -1.60158,42.81175,"SEM ROBS Av Reino Navarra N. DIR W" -0.39986,39.41202,"SEM ROBS Blasco Ibañez 1 Massanasa DIR Ambas" -0.39891,39.41429,"SEM ROBS Blasco Ibañez 2 Massanasa DIR Ambas" -4.08802,43.35980,"SEM ROBS CA-133 Num 122 DIR Ambas" -3.85374,43.30854,"SEM ROBS CA-613 Km DIR N" -0.40495,39.39954,"SEM ROBS Camí Real 1 Catarroja DIR Ambas" -0.40352,39.40259,"SEM ROBS Camí Real 2 Catarroja DIR Ambas" -0.40300,39.40395,"SEM ROBS Camí Real 3 Catarroja DIR Ambas" -3.79320,40.46220,"SEM ROBS Camino del Barrial DIR SE" -3.69052,40.45463,"SEM ROBS Castellana 105 DIR Sur" -3.77426,40.39682,"SEM ROBS Crtra Carabanchel a Aravaca" -0.38000,39.42539,"SEM ROBS CV-407 33 Sedaví DIR ESE" -0.38680,39.42851,"SEM ROBS CV-407 Sedaví DIR W" 2.81702,41.97555,"SEM ROBS Emili Grahit N 3 DIR W" -3.76838,40.22662,"SEM ROBS JC-I 23 DIR NNW" -3.77528,40.24274,"SEM ROBS Leganes 36 DIR W" -5.57032,42.61244,"SEM ROBS Mariano Andrés_Don Juan DIR pte" -3.70247,40.47981,"SEM ROBS Monforte de Lemos con Finisterre" -3.65991,40.49108,"SEM ROBS Pí i Margall 74 DIR NE" -0.43461,39.43484,"SEM ROBS Preciossisima Sangre DIR NE" -0.40204,39.40651,"SEM ROBS Ramón y Cajal Catarroja DIR Ambas" -3.76766,40.24500,"SEM ROBS Real DIR N" -8.55117,42.87161,"SEM ROBS Romero Donallo DIR NW" -8.53349,42.89174,"SEM ROBS San Caetano DIR NNE" -8.76475,42.58906,"SEM ROCC Agustin Romero DIR S" -8.40895,43.36712,"SEM ROCC Av Finisterre Alfredo Vicenti DIR" -8.40801,43.36231,"SEM ROCC Juan Flórez Nicaragua DIR" -8.40545,43.36243,"SEM ROCC Linares Rivas Marcial del Adalid DIR" -8.40537,43.36496,"SEM ROCC Plaza Orense DIR" -3.60611,37.17001,"SEM ROWD Neptuno DIR NE" -3.68648,42.34295,"SEM SAUL Av Arlanzón 41 DIR El Plantío" -3.68767,42.34696,"SEM SAUL Av Cantabria 21 DIR Centro" -3.68886,42.34958,"SEM SAUL Av Cantabria 42 DIR Santander" -3.69618,42.34944,"SEM SAUL Av Cid 76 DIR Hospital" -3.67676,42.34907,"SEM SAUL c/ Vitoria 144 DIR Centro" -3.71800,40.38491,"SEM SERG Via Lusitana DIR NE" -8.77015,42.58958,"SEM TACA Dr Tourón 55 DIR Cambados" -3.65475,40.41071,"SEM TAMI Camino Vinateros CRUCE Media Legua DIR Oeste" -3.71009,40.44007,"SEM TAMI Islas Filipinas 18 DIR Suroeste" 2.17025,41.39962,"SEM TDRS Mallorca DIR SW" -3.71069,40.43002,"SEM TEKI Alberto Aguilera con Baltasar Gracian" -3.70057,40.43850,"SEM TEKI Jose Abascal DIR E" -3.66800,40.42100,"SEM THUN O-Donnell CRUCE Dr Esquerdo DIR Noroeste" -3.71218,40.48058,"SEM TYPH Av Ilustración CRUCE Betanzos DIR Oeste" -3.59366,40.46024,"SEM TYPH Av Logroño 42 DIR Noreste" -3.62524,40.42040,"SEM UNIV Hnos García Noblejas 186 DIR Noroeste" 2.44139,41.54450,"SEM VIMA Pl España 18 DIR Suroeste" -1.65224,42.81438,"SEM VIRE Pamplona Av. Ejército 1 DIR Noroeste" 2.29544,41.49384,"SEM VISA Ángel Guimerá 9 DIR Granollers" -6.13527,37.33733,"SEM VTS- Bollullos Mitación Avda Constitución 26 DIR Noreste" -6.13699,37.33549,"SEM VTS- Bollullos Mitación Ctra Almensilla 1 DIR Norte" -6.01247,37.39610,"SEM VTS- Carlos III CRUCE Fco. Montesinos DIR Norte" -6.01036,37.40437,"SEM VTS- Carlos III CRUCE Gregor Mendel DIR Sur" -5.93604,37.40447,"SEM VTS- Luis Uruñuela-Gta Pal Congresos DIR Noreste" -5.93526,37.40489,"SEM VTS- Luis Uruñuela-Gta Pal Congresos DIR Suroeste" -5.96616,37.37196,"SEM VTS- Ronda Tamarguillo-1 DIR Noreste" -5.96327,37.37463,"SEM VTS- Ronda Tamarguillo-2 DIR Noreste" -5.94712,37.42225,"SEM VTS- SE-20 Km 3.0 DIR Noroeste" -5.94757,37.42284,"SEM VTS- SE-20 Km 3.1 DIR Sureste" 2.22697,41.52691,"SEM WARP Sant Fost Campsentelles Carrer Barcelona 46 DIR Mollet" 2.21892,41.54568,"SEM WEYN Can Flaquer 17 DIR Cementerio" 2.21819,41.54610,"SEM WEYN Can Flequer 24 DIR C-17" 2.21091,41.54720,"SEM WEYN Rivoli 20 DIR W" 2.17568,41.40028,"SEM XAVI Aragón 430 DIR Llobregat" 2.18487,41.40716,"SEM XAVI Aragón 555 DIR Llobregat" -4.68738,40.65608,"SEM XORQ Hornos Caleros 5 DIR Av Madrid" 