2.14501,41.34900,"CA MAIG Rda Litoral Sal 13 DIR Besos" 2.11440,41.40115,"CA MAIG Rotonda Can Caralleu, BARCELONA" 2.09358,41.36969,"CA MAIG Sal. 13 Ronda de Dalt BCN" 2.29864,41.48913,"CA MAIG Sal. 86 Salida/Entrada Peaje Alella" 2.08007,41.30761,"CA MAIG Saliendo del Aeropuerto BCN" 2.43378,41.52971,"CA MALA FINDE" 2.44319,41.53212,"CA MALA Finde Av Maresme Con Rda Barcelona MATARO" 2.30719,41.61464,"CA MALA FINDE Ctra Granollers A Girona" 2.30114,41.60017,"CA MALA Noches Calle Costa Brava" -3.47914,43.46083,"CA MALD CA-141 a Santoña" -3.48618,43.4571,"CA MALD CA-141 Piedrahita" 1.57260,41.193570,"CA MANA C-31" -6.56293,37.01583,"CA MANO Matalascañas" -2.98444,43.29129,"CA MANR Artzain Ona Kalea Vizcaya (Bi)" -2.96238,43.30758,"CA MANR BI-637 Vizcaya (Bi)" -2.97714,43.30722,"CA MANR BI-711 Vizcaya (Bi)" -4.04657,43.38677,"CA MANR Suances Ca-132" -4.04732,43.37723,"CA MANR Torrelavega CA-131 (Junto A Solvay)" -3.72470,40.33920,"CA MANU A-42" -3.08527,43.33001,"CA MANU A-8 (Bi)" -3.41585,43.34757,"CA MANU Ampuero N-629" -2.94740,43.26010,"CA MANU Avda Sabino Arana (Bilbao)" -4.52980,42.01947,"CA MANU Avda Santander " -2.97944,43.38944,"CA MANU BI-2122" -2.67810,43.32450,"CA MANU BI-2235" -2.87194,43.23417,"CA MANU BI-625" -2.68666,43.29583,"CA MANU BI-635" -2.70160,43.41100,"CA MANU BI2235 2" -2.92960,43.26170,"CA MANU C/Alameda Urquijo (Bilbao)" -3.23174,43.39135,"CA MANU Castro Urdiales C/Santander" -3.21498,43.36922,"CA MANU Castro Urdiales Po Menendez Pelayo" -3.44852,43.38998,"CA MANU Colindres N-629" -3.46324,43.39354,"CA MANU Colindres N-634" -5.65700,43.54120,"CA MANU Gijón (Asturias). En La Calle Eladio Carreño " -3.43814,43.40406,"CA MANU Laredo C/Rep. Colombia" -3.40767,43.41215,"CA MANU Laredo N-634" -3.58220,40.58220,"CA MANU M-100" -3.54380,40.82440,"CA MANU N-102" -3.55480,40.82140,"CA MANU N-320" -3.52020,40.77360,"CA MANU N-320 2" -8.61099,42.29970,"CA MANU PO-2903 Rotonda DIR Todas" -3.45501,43.44723,"CA MANU Santoña CA-141" -3.48588,43.41006,"CA MANU Santoña CA-241 Cicero N-634" -3.74784,43.38873,"CA MANU Solares N-635" -2.91917,43.24583,"CA MANU Viaducto Miraflores (Bilbao)" -2.56757,38.62491,"CA MANZ  N-322" -3.38092,38.76722,"CA MANZ CM-412" -3.40442,38.76712,"CA MANZ CM-412 Valdepeñas" -3.380928,38.985242,"CA MANZ CM-9313" -3.36695,38.64561,"CA MANZ CR-612 Valdepeñas" 2.77740,41.77899,"CA MARC Mossos desquadre,Vidreres,Girona." 2.18412,41.43021,"CA MASS Passeig de Fabra i Puig,Barcelona" -3.58088,40.46699,"CA Mc Camino Del Cuartel - Barajas - Madrid " 2.25000,41.95833,"CA MC Chocovic-Dir. Nord (Sota Eix Transversal)" 2.24917,41.95861,"CA MC Chocovic-Dir. Sud (Sota Eix Transversal)" -3.84986,40.31665,"CA MC PDIS Control De Alcoholemia En Mostoles-Madrid" -3.51722,40.39417,"CA MC66  Rda. Ctra San Fernado A Mejorada" -3.68917,40.42420,"CA MELK C/Jorge Juan" -3.68444,40.42222,"CA MELKKO Calle Velazquez 8.11 (M)" -3.68806,40.43333,"CA MELKKO Lateral Pso Castellana 33.40 (M)" 2.39844,41.51870,"CA MHCS ROTONDA CRTA ARGENTONA" 2.42211,41.53332,"CA MHCS Rotonda Mas Costabella MATARO" -4.70611,40.64232,"CA MIAV AV-900 Carretera de Burgohondo" -4.68440,40.65777,"CA MIAV Carretera Villacastin-Vigo" -4.67993,40.65978,"CA MIAV Carretera Villacastin-Vigo, Avenida Juan Carlos I" -4.69673,40.65780,"CA MIAV Plaza de San Vicente" -0.45628,38.71969,"CA MICC CV-7890 Rotonda Carrer Tollos" -0.44366,38.73286,"CA MICC N-340a Con Benifleta" -0.45132,38.72602,"CA MICC N-340a Con N-340" -0.45714,39.28843,"CA MIG1 CV520 3.3 Km Control Alcoholemia Domingos" -5.94506,37.40076,"CA MIKO SE-30 Incorporación DIR Carmona" -8.72687,42.20431,"CA MMAR Vigo Subida Al Cuvi Tras Rotonda" -5.55035,40.94532,"CA MMD Dir Madrid En Fronton" -5.57950,40.88191,"CA MMD Rotonda Encinar Cisnes" -4.95018,36.49524,"CA MNSB Puerto Banus Dir San Pedro Alcantara." -4.92694,37.67694,"CA MONT N-IV Bajando Cuesta De La Carlota" 1.87778,41.52778,"CA NANA Salida De Discoteca - Esparraguera" -3.86725,40.48651,"CA NARE M-505 18 Glorieta Cruz Roja" -3.63887,40.53229,"CA NCAM A1 Salida 16 Dir Burgos" 0.13394,40.10496,"CA NEST CONTROL DOCUMENTACION ENT-SAL AP-7 OROPESA" -5.96625,37.38147,"CA NETI Sevilla Calle Gran Plaza" -3.91506,40.37147,"CA NEXV M-501 Rotonda Universiadad DIR Todas" -3.92098,40.36646,"CA NEXV M-501 Rotonda Urb El bosque DIR Todas" -3.91914,37.76270,"CA NGDR A-316 Glorieta Torredonjimeno" -3.70000,42.00000,"CA NICK TEXTO" -2.73677,42.42440,"CA NODO Km 26.200 N-120" 2.10041,41.52456,"CA NOMO BV-1414 Crta de Bellaterra incorporacion C-58 Mossos" 2.09858,41.51443,"CA NOMO BV-1414 Crta de Bellaterra Mossos" -0.79492,38.24975,"CA NOST Crevillent Rotonda Direccion La Garganta" -0.73859,38.25779,"CA NOST N-340  Elche Crevillente Frente Concesionario Renault" -3.52433,39.46067,"CA NUE ROTONDA CRUCE A-4 CM-42 . Madridejos. Hacen Soplar Y Pedir Documenta" -3.56526,39.46306,"CA NUE ROTONDA CRUCE CM-400 CM- Madridejos. Te Piden Documentacion Y Contro" 0.51377,41.56049,"CA NUM Control Dom Manana" 0.59371,41.63149,"CA NUM Control Mierc Jueves" 0.58286,41.61039,"CA NUM Control Sab Cruce" -8.61830,42.28315,"CA ÑERO N-552" -8.67606,42.25740,"CA ÑERO N-552 Calle De Angel De Lema Y Marina" -2.93666,43.26702,"CA ODET Pm Mazarredo" -7.86820,42.30475,"CA Orense A-52 Sal. 224" -0.52117,38.30371,"CA OUTB Alicante" -0.93937,38.72992,"CA PALI A-31 km 172 controles finde en gasolinera" -2.44852,41.03936,"CA PALM Enlace A-2 N-211 Alcolea" -6.07498,43.52088,"CA PARA AS-16 DIR Ambas" -6.11708,43.49347,"CA PARA AS-225 DIR Ambas" -8.32682,43.33149,"CA PBLM AC-174 Ctra Perillo Montrove Frente Gasolinera" -8.26726,43.35102,"CA PBLM AC-183 Ctra Oleiros Sada Frente Tanatorio" -8.37821,43.33405,"CA PBLM Oleiros-Sta Cristina  Av Che Guevara" -3.88307,40.31490,"CA PDIS  Algun Fin De Semana" -1.65762,42.81477,"CA PDIS  Avenida De Bayona (Pamplona)" -0.50967,38.32849,"CA PDIS Avd. De Elche Estacion Del Tren" -1.66874,42.83321,"CA PDIS Avenida De Guipuzcoa (Pamplona)" -1.64414,42.80765,"CA PDIS Avenida De Zaragoza (Pamplona)" -3.80673,43.46154,"CA PDIS Calle De Calvo Sotelo (Santander)" -1.64754,42.81443,"CA PDIS Calle De Padre Moret (Pamplona)" -1.68308,42.84430,"CA PDIS Carretera De Guipuzcoa (Pamplona)" -1.20652,37.97455,"CA PDIS Cruce Avd.Principe - Ctra. La Nora" -0.54489,38.98185,"CA PDIS Findes Novetle" -0.52859,39.00202,"CA PDIS Findes Xativa . Ronda Salida Dir VLC" -4.05436,39.84305,"CA PDIS Fines De Semana" -4.15853,39.79284,"CA PDIS Fines De Semana 10" -3.72782,40.30164,"CA PDIS Fines De Semana 11" -3.72791,40.30789,"CA PDIS Fines De Semana 2" -3.76464,40.25265,"CA PDIS Fines De Semana 3" -3.81830,40.34779,"CA PDIS Fines De Semana 4" -3.80104,40.34123,"CA PDIS Fines De Semana 5" -3.76157,40.27485,"CA PDIS Fines De Semana 6" -3.72140,40.36206,"CA PDIS Fines De Semana 7" -3.76685,40.24783,"CA PDIS Fines De Semana 8" -3.82570,40.35285,"CA PDIS Fines De Semana 9" -3.84470,40.32451,"CA PDIS Guardia Civil" -3.58056,40.45722,"CA PDIS Guardia Civil  Aeropuerto Barajas (No Alcohol)" -3.93746,40.29417,"CA PDIS Guardia Civil. Normalmente Solo Piden Documentos" -3.54308,40.58796,"CA PDIS M-106 Algete (M)" -3.52061,40.42368,"CA PDIS M-206 San Fdo. Control varios" -3.86912,40.48239,"CA PDIS Majadahonda C/Reyes Catolicos" 2.64141,39.57191,"CA PDIS Paseo Mallorca-zolople" -3.82643,43.45862,"CA PDIS Plaza De Cuatro Caminos (Santander)" -3.78788,43.46792,"CA PDIS Plaza Del Alto De Miranda (Santander)" 1.28175,41.12344,"CA PDIS Tarragona-Barna.Casi Todos Los Findes Noche" -4.04576,43.35692,"CA PDIS Torrelavega Antes De Entrar En La Autovia A67 DIR Santander" -4.06480,43.35405,"CA PDISTorrelavega N634 Direccion Oviedo" -8.40209,43.33293,"CA PDIZ AC-11 DIR SE Elviña" -7.88408,43.44025,"CA PDIZ AC-142 As Pontes " -8.19186,43.50509,"CA PDIZ AP-9F DIR Ambas Rotonda" -7.7605,42.162698,"CA PDIZ Control mixto G.C." -7.50326,43.68352,"CA PDIZ N-642 Entrada De Xove" -7.43227,41.94955,"CA PDIZ OU-113 Ctra. De Laza GC -VERIN-" -8.62191,42.13554,"CA PDXO A-55 As Gandaras En La Rotonda" -2.46303,36.83545,"CA PECA Fines De Se Plaza De Emilio Perez" -7.33673,37.24972,"CA PEDR A-499 acceso a E-1  A-49" -7.26703,37.20511,"CA PEDR A-5054 con HU-3400" -8.404179,43.27371,"CA PEGA AC-253 En rotonda enlace A-6" -8.62558,42.86762,"CA Pega AC-543 Alcol O Docum" -8.18068,43.53718,"CA pega AC-566 Control Alcoholemia y documentacion" -8.07906,42.99046,"CA PEGA AC-840 Alcol O Docum" -8.20573,43.25990,"CA Pega AC-840 Alcol O Docum" -7.84593,43.44289,"CA pega AC-861 Control Alcoholemia y documentacion" -7.86878,43.44199,"CA pega AC-861 Control Alcoholemia y documentacion" -8.17219,43.44282,"CA Pega AP-9 Alcol O Docum" -8.13964,42.66899,"CA PEGA N-525 Docum Y Alcohol" -8.37643,43.30797,"CA pega N-550 Control Alcoholemia y documentacion" -8.05269,42.74612,"CA PEGA N-640 Alcoholemia" -8.05267,42.74592,"CA PEGA N-640 Alcoholemia" -8.07375,42.71846,"CA PEGA N-640 Alcoholemia" -8.23631,42.71091,"CA Pega PO- 205 Alcol O Docum" -8.02589,42.84405,"CA PEGA PO-840 Alcoholemia" -8.02458,42.76874,"CA PEGA PO-840 Alcoholemia" -3.55908,40.35806,"CA PEJE PN-3 Madrid Valencia. en gasolinera via de servicio" -5.01825,41.50339,"CA PEP1 N-122 En Rotonda" -4.91591,41.52526,"CA PEP1 Salida 145 S. Miguel Del Pino" 4.11475,40.02729,"CA PEPE Carretera ME-7" -7.34707,43.44683,"CA PEPE N-634 km 586 Mondoñedo camu" -7.42735,43.38145,"CA PEPE N-634 km 600.5 O Chao Aldea camu" -7.46403,43.36582,"CA PEPE N-634 km 603.5 control en aparcamiento" 4.17489,39.99041,"CA PEPE REdonda ME-9/ME-7/PM-707" -5.25528,43.47917,"CA PEPT As-260  Control Alcohol" 2.73740,39.63150,"CA PERE Ma-13A Festival Park en rotonda" 3.01627,39.64722,"CA PERE MA-3510 Sineu en rotonda" -4.44980,36.70754,"CA PGR Avda Alcalde Diaz Zafra Con Camino San Rafael" -1.10129,39.48346,"CA PIKE N-III C. Barriete Requena" -4.18901,41.37593,"CA PIRI  CL-112 Frumales" -2.90349,43.27051,"CA PIRRA BI-631 Bilbao" -4.36908,40.05974,"CA PITU N-403 Toledo" 1.31076,42.07151,"CA PLAY C-14 Mossos Saliendo De Oliana Direccion Coll De Nargo" 1.57133,42.52901,"CA PLAY Control Policia AND CG-2  Rotonda Entrada" 1.52015,42.53687,"CA PLAY CS-314 En Gasolinera. Sentido Escaldes" -1.83469,37.11893,"CA PLOT Pso. Del Mediterraneo Mojacar (AL)" -6.59975,42.55225,"CA Ponferrada C. Lago Baña" -4.70733,41.60746,"CA PPLG CL-601 Carretera Segovia Entrada A Valladolid" -4.52427,42.02703,"CA PPLG Entrada Palencia(Carretera Santander)" -4.71987,41.65543,"CA PPLG Frente Hospital Clinico VALLAD (Algunas Veces)" -4.68694,41.68652,"CA PPLG Santovenia C Real Con L 113" -4.69459,41.67803,"CA PPLG Va-113 Avd. de Santander 112" -4.74285,41.68049,"CA PPLG Va-900 Carretera Fuensaldaña" -4.11742,40.64805,"CA PSEG Ctra Cuelgamuros" -4.11655,40.94530,"CA PSEG Segovia C Alferez Provisional" -4.11695,40.94836,"CA PSEG Segovia CL-601 Via Roma" -4.10700,40.94181,"CA PSEG Segovia Ctra Palazuelos" -4.11750,40.94167,"CA PSEG Segovia Ezequiel Glez" -4.12388,40.94675,"CA PSEG Segovia Ezequiel Gonzalez" -4.10972,40.92750,"CA PSEG Segovia Salida AP-61" -3.81778,40.46973,"CA PVT A-6 Ctra. De La Coruña, Km.13. MADRID" -3.61979,40.79173,"CA RAFA cruce de la M-608 con la N-I" -3.72029,40.60846,"CA RAFA Tres Cantos Madrid, muy habitual noches de X a S" -3.72207,40.60752,"CA RAFA única entrada que tiene Tres Cantos por la N-607 dirección Madrid d" -4.11794,40.97822,"CA RAHE  La Lastrilla CL-601 todas las entradas" -0.76306,37.89167,"CA RAMA N-332 Dehesa De Campoamor" -1.56251,37.41724,"CA RAUL Fines d semana. fiestas" 2.21802,41.52720,"CA RDRI Can Pratsolo Findes" 2.23616,41.53283,"CA RDRI Martorelles Solo Findes" -4.75444,43.41139,"CA REAL La Portila" -3.57989,40.20600,"CA REVE M-307 Av. Alcalde Antonio Chapado" -3.58181,40.20107,"CA REVE M-307 Direcc. Cienpozuelos" -3.59448,40.21844,"CA REVE M-506 Ctra. Pinto San Martin de La Vega" -2.94634,35.29022,"CA REWO Av. De La Duquesa Victoria. Melilla" -2.93939,35.29034,"CA REWO Avda De La  Marina Española. Melilla" -2.93817,35.27684,"CA REWO C/De General Astilleros 1. Melilla" -2.93983,35.27966,"CA REWO C/De General Astilleros 2.  Melilla" -2.94537,35.27692,"CA REWO Carretera De Haddú 1. Melilla" -2.94560,35.27692,"CA REWO Carretera De Haddú 2. Melilla" -2.93811,35.28655,"CA REWO Pso. De Maritimo Rafael Ginel. Melilla" -3.62577,40.39140,"CA REYAM Incorporación A La A-3. Altura De La M-40" -3.56647,40.39818,"CA REYAM Madrid R-3 Direccion Arganda Altura Peaje M-45" -3.49145,40.38309,"CA REYAM Salida R3" -3.43420,43.40235,"CA RGMA Laredo (Cantabria)" -5.94769,37.29331,"CA RICS N-IV detrás de curva dirección Sevilla, Dos Hermanas" -5.97073,37.31007,"CA RICS N-IV Pol. La Palmera . Despues de curva viniendo de Bellavista" -5.51699,43.35508,"CA RIZO As-251 Nave Del Ayuntamiento" -5.51192,43.36331,"CA RIZS N-634 Villabona" 2.22304,41.54370,"CA Rotonda Los Mossos" 2.20609,41.53053,"CA Rotonda Opel" -8.05712,42.42497,"CA RUFZ N-541 DACON" -8.20796,43.28626,"CA RUFZ N-651 Betanzos" -4.47777,36.65225,"CA SAIRALDO Camino Cizaña - Club De Golf (Ma)" -5.44697,37.27509,"CA SANPE Marchena. Sevilla 1" -5.42546,37.32828,"CA SANPE Marchena. Sevilla 2" -5.42350,37.32618,"CA SANPE Marchena. Sevilla 3" -5.40928,37.32995,"CA SANPE Marchena. Sevilla C/Cerro La Leva" -1.39135,41.08057,"CA SDLL Villanueva De Jiloca" -0.42993,39.47478,"CA SEPU Pol. Industrial Mislata" -3.82235,40.28732,"CA SERAK Fuenlabrada Madrid" -6.36682,38.89313,"CA SERK B-038 Merida" -2.83884,42.56314,"CA SITO N-124 Haro La Rioja" -2.96244,43.30003,"CA SMUR Asua - Vizcaya" -5.57138,42.58722,"CA SOGU Avda Falcultad veterinaria 27 al lado de la plaza toros de Leon" -5.57046,42.59393,"CA SOGU En la calle Alcalde Miguel Castaño 5 de Leon" -5.89222,42.31194,"CA SOGU En la carretera de la Bañeza-Leon a lado del concesionario de tract" -5.57388,42.31527,"CA SOGU En la CL-621 En la salida de Valencia De Don Juan hacia Leon" -5.74833,42.34694,"CA SOGU En la entrada de Sta. Maria del Paramo por la LE-413" -4.72472,41.60389,"CA SOGU En la N-601 de Valladolid direcion Madrid antes de la entrada a Fas" -1.19546,41.55722,"CA SOLD Control GC Bascula Tras Bajar La Muela" -1.41053,41.14308,"CA SOLD N-234 Control GC - Alto Puerto Villafeliche - Muy Habituales" -1.33679,41.01515,"CA SOLD N-234 Control GC - Salida Burbaguena - Paran Del Camu Anterior" -1.39111,41.08028,"CA SOLD N-234 Villanueva De Jiloca" -7.50311,42.96930,"CA SOYF LU-546" -3.71308,40.42175,"CA SPAR Bajo rotonda Bailen DIR Ambas" -3.69108,40.425222,"CA SPAR Genova 1 DIR ESE" -3.69368,40.41332,"CA SPAR Pº del Prado M. Sanidad DIR S" -1.07962,38.05110,"CA SPMS N-340 Km 673 Cobatillas dir Santomera" 1.64789,41.59183,"CA STGS Bv-1106" 1.66826,41.56895,"CA STGS Calle De Narcis Monturiol" 1.64277,41.57959,"CA STGS Carretera Nacional II" -0.30546,39.21698,"CA STIE CV-500 Sentido Sueca - Domingos mañana" -0.45057,39.20645,"CA STIE En toda la rotonda, fines semana." -5.57594,42.59688,"CA STIE León P. Local Avd. Ordoño II" -1.65398,42.81327,"CA STIE Valencia Avenida De Pío XII alcoholemia" -2.94628,42.69081,"CA STIR Rotonda A-2122 Y N-I Km 319" -4.05651,39.81399,"CA Su33 Control Alcoholemia Gasolinera Argés" 1.82305,41.23928,"CA TABA Final Carretera Costas Del Garraf (C31) Fi" -3.62732,40.41474,"CA TANA Carrantona bajo puente" -3.63116,40.40816,"CA TANA cruce carrantona -c.v.vicalv." -3.62317,40.41708,"CA TANA gl.carrefour" -1.14720,38.00155,"CA TAOS Control de Documentacion avenida del ciclista mariano rojas (Mu)" -1.14290,37.99729,"CA TAOS Control de Documentacion avenida miguel de cervantes (Mu)" -1.16362,38.00534,"CA TAOS control de documentacion en espinardo murcia" -6.00892,37.40708,"CA TATR C/Marie Curie, cruce con Avda. Carlos III (Se)" -5.99785,37.40115,"CA TATR C/Torneo direcc. Puente de la Barqueta (Se)" -6.00810,37.41287,"CA TATR Rotonda Avda. Carlos III-SE-20/SE-30 (Se)" -6.06022,37.38450,"CA TATR Rotonda Castilleja-Gines-Bormujos (Se)" -5.99860,37.40547,"CA TATR Rotonda Isla Mágica (Se)" -3.15882,40.62210,"CA THUN Guadalajara" -4.02651,40.62342,"CA TINI M-510 Carretera de Galapagar Control Alcohol" -5.45815,36.10999,"CA TIRI E5/N340 Tarifa Algeciras" -3.71157,40.47066,"CA TOM5 (M) Glor.Piedrafita Cebrero.Final Cap.Bco.Argibay-Chorrillo.Frecuen" -2.80749,37.50923,"CA TOM5 A-315 Baza (Granada) 1" -2.78842,37.50391,"CA TOM5 A-315 Baza (Granada) 2" -2.80091,37.50168,"CA TOM5 A-315 Baza (Granada) 3" -6.36250,38.93750,"CA TOM5 A-5.Sal 341 A Mérida.EX-209.Junto Gasolinera En Rotonda" -5.15074,43.37435,"CA TOM5 Asturias.N-625" -5.17988,43.38917,"CA TOM5 Asturias.N-625" -5.83668,43.35901,"CA TOM5 Asturias.N-630" -5.42390,43.49230,"CA TOM5 Asturias.N-632" -6.06939,43.53431,"CA TOM5 Asturias.N-632 2" -5.18400,43.37790,"CA TOM5 Asturias.N-634" -6.66821,42.07558,"CA TOM5 Bo Lomba-Zamora.Gdia.Civil Controla Alcoh. Y Docum." -3.96244,43.32150,"CA TOM5 Cantabria.N-623.Vargas.Rotonda" -3.70665,43.39072,"CA TOM5 Cantabria.N-634.El Bosque.Rotonda" -3.66537,43.38988,"CA TOM5 Cantabria.N-634.Hoz De Anero.Rotonda" -3.57611,43.41522,"CA TOM5 Cantabria.N-634.Rotonda En Centro De Beranga (peligroso)" -3.72803,43.38538,"CA TOM5 Cantabria.N-634.Rotonda Entrada A Solares" 2.15611,41.48583,"CA TOM5 Cerdanyola Del Vallés (B) Av Canaletes/Rda Cerdanyola" -1.23239,38.10257,"CA TOM5 Ceutí.MU.N-301" -3.81679,41.24347,"CA TOM5 CL-112.Gdia.Civil Controla Alcoh. Y Docum." -5.52007,40.82608,"CA TOM5 CL-510.Gdia.Civil Controla Alcoh. Y Docum." -5.59421,40.90751,"CA TOM5 CL-510.Gdia.Civil Controla Alcoh. Y Docum." -8.44408,43.34163,"CA TOM5 Coruña AC-552 Salida Autovía A-6" -6.63659,42.08699,"CA TOM5 El Puente-Zamora.Gdia.Civil Controla Alcoh. Y Docum." -5.66472,43.53806,"CA TOM5 Gijón.Junto Parque De Pza Europa.Parada Autobús" -1.20247,38.06875,"CA TOM5 Inicio A-5.Molina De Segura." -3.70695,40.48419,"CA TOM5 Madrid Fermin Caballero Alt 52 Prox Ginzo Limia B. Pilar" -6.34061,38.91088,"CA TOM5 Mérida.Av Reina Sofia (También 050)" -6.35056,38.91750,"CA TOM5 Mérida.Rotonda Final Pte Lusitania Con Av J.Fdez López" -1.22302,38.07091,"CA TOM5 Molina D Segura.MU.Ctra. De Madrid N-301" -6.12064,36.39109,"CA TOM5 N-340 Chiclana En Rotonda Frec. Pres. Guardia Civil" -0.07627,39.95669,"CA TOM5 N-340A.Almazora (Castellón).Dir Castellón.Pasada Gasolinera ERG-" -8.16788,43.41273,"CA TOM5 N-651.Rotonda De Cabanas" -3.73092,41.30302,"CA TOM5 SG-232.Gdia.Civil Controla Alcoh. Y Docum." -3.74130,40.39332,"CA TREM  Av. Nrta Sra. Valvanera (M)" -0.03567,39.98357,"CA TRIL  Plaza Del Juez Borrull " 1.17722,41.26331,"CA TRIL Ctra. Sin Nombre" -6.03517,37.41038,"CA TRTI Rotonda Camas-Santiponce (Se)" -5.16909,39.79839,"CA TUNI Fin De Semana Tardes-noches Puente Del Arzobispo (To)" -7.07165,37.32023,"CA TXA Control Alcoholemia. En La Rotonda . Sentid" -6.04680,42.47205,"CA TXEM Carretera De Pandorado" -4.90613,41.29938,"CA TXOR Carretera De Madrid - Medina Del Campo" -3.48583,43.45722,"CA UFO Argoños Cantabria" 2.82981,41.69919,"CA ULIN Avinguda De La Vila De Blanes  LLORET" 2.82107,41.69627,"CA ULIN GI-682 De Blanes A Lloret Fines Semana" 2.83131,41.71391,"CA ULIN LLORET Control Policia" 2.82117,41.69691,"CA ULIN LLORET Control Policia" 2.80265,41.68913,"CA ULIN Lloret De Mar" -6.08346,36.68576,"CA VALM A-2003 Jeréz" -5.94649,37.35433,"CA VALM A-476 DIR Utrera parada bus fin semana" -5.946299,37.354509,"CA VALM Control Alcoholemia A-476" -5.938958,37.348701,"CA VALM Control de Alcoholemia en la entrada a Montequinto " -5.95768,37.36062,"CA VALM Gota de leche. Gasolinera Shell" -6.83000,37.14000,"CA VANH CONTROL DE ALCOHOLEMIA EN MAZAGON  ( HUELVA)" -6.92528,37.19556,"CA VANH CRUZE LA RABIDA - MAZAGON (HUELVA)" -3.76720,40.39902,"CA VARO Control Alcoholemia" -8.81635,43.03554,"CA VDAL AC-404 Sta Catalina Sabados CLAV" -8.96552,43.14828,"CA VDAL AC-430 Cruce Baio Fines De Semana" -8.96670,43.15604,"CA VDAL AC-430 Iglesia Baio Pequeno Fines De Semana" -8.95759,43.19046,"CA VDAL AC-430/AC-431 Borneiro Viernes Y Sabados Por La Mañana" -8.83054,43.31848,"CA VDAL AC-4307 Lugar De Seaia" -9.04177,43.11870,"CA VDAL AC-552 Salida Vimianzo Dir Camariñas Fines De  Semana" -9.02766,43.11216,"CA VDAL AC-552 Salida Vimianzo Fines De Semana" -9.03814,43.10388,"CA VDAL AC-552 Vimianzo Cruce Fiines De Semana" -8.92368,43.22203,"CA VDAL Neaño (Cabana Bergantiños) Viernes Y Sabados" -1.27361,38.11972,"CA VENT Archena MU" 2.11326,41.51312,"CA VGHK Barbera Av Cantabrico Badia" 2.09148,41.50964,"CA VGHK BV-1414 Bellaterra" -3.99336,40.39610,"CA VICB " -3.18094,40.62699,"CA VICG Guadalajara rotonda salida A-2 DIR Av Ejercito" 0.25353,40.24854,"CA VICH Alcossebre" 0.27303,40.24395,"CA VICH Alcossebre" -8.57892,42.87173,"CA VIDAN Madrugadas Festivos. Viernes Y Sabados" -0.45795,38.38328,"CA VIIB A-7 Salida 68" 2.20467,41.51042,"CA VMSC C33 Peaje Llagosta Fines De Semana-" -1.86042,38.98396,"CA VOYV Cap. Cortes DIR NW" -3.63870,40.39178,"CA VPAR Playa de Gandia (V)  Domingos y visperas de fectivos a partir de la" -8.15000,43.59583,"CA VVCO Galicia" -5.88950,37.30713,"CA VVVV A-392 Lado rotonda" -7.10460,37.70714,"CA VVVV A-495 El Cerro " -6.98340,37.37807,"CA VVVV A-495 Km 0.050" -5.95194,37.40730,"CA VVVV Av Kansas City Sevilla" -5.92420,37.18095,"CA VVVV Av Sevilla DIR Sevilla fines semana" -5.65149,37.48005,"CA VVVV Carmona P.Industrial" -5.70836,37.40399,"CA VVVV El Viso de Alcor" -5.98216,37.37952,"CA VVVV Enramadilla DIR Sevilla centro fines semana" -6.17440,37.35633,"CA VVVV SE-629 Umbrete" 2.97045,42.23882,"CA XAVI 001" 2.95910,42.24382,"CA XAVI 002" 2.87030,42.04908,"CA XAVI A-2 Mendinya Sentido Sur (Girona)" 0.55898,40.58649,"CA XAVI N-340A Vier Y Sab Noche" -5.92748,37.38570,"CA XIN0 SALIDA A-92 FRENTE PERSAN" 2.71292,39.59006,"CA XISC Palma De Mallorca (baleares) 1" 2.71103,39.57874,"CA XISC Palma De Mallorca (baleares) 2" 2.71268,39.61001,"CA XISC Palma De Mallorca (baleares) 3" 2.63451,39.58841,"CA XISC Palma De Mallorca (baleares) 4" 2.62358,39.55319,"CA XISC Palma De Mallorca (baleares) 5" 2.18727,41.56888,"CA XOAN C-155 Can Boada muy frecuente" 2.15347,41.51880,"CA XOAN Can Salvatella control Mossos en rotonda" -5.707,41.0093,"CA XUPS Carretera SA-300 en la rotonda de acceso a la Urb. Los Almendros" -5.9235,37.385939,"CA XUPS en la salida a Sevilla Este de la autovía A-92 dirección Málaga" -5.71122,43.49740,"CA XURD AS-18" -5.67859,43.50858,"CA XURD AS-246" -5.65370,43.49592,"CA XURD AS-248" -5.65877,43.51454,"CA XURD AS-248 Carretera De Pola De Siero" -5.60236,43.51072,"CA XURD Ctra. Sin Nombre" -5.66429,43.54222,"CA XURD Plaza De Carmen" -7.87284,42.30628,"CA YACU A-52 Salida a N-525" -3.76480,40.38443,"CA YOSO Aluche,al Lado Junta De Distrito" -3.77120,40.39370,"CA YSPP Avda Poblados Antonio Urosa" -3.75995,40.38680,"CA YSPP C/Rafael Final" -3.75900,40.40039,"CA YSPP Calle Los Yebenes" -3.69490,40.41540,"CA YSPP Carrera San Jeronimo" -3.69300,40.41890,"CA YSPP Cibeles Carril Izquierdo" -6.30750,40.31861,"CA YSPP EX-204 Caminomorisco" -6.33417,40.29889,"CA YSPP EX-204 Pinofranqueado" -3.70380,40.42020,"CA YSPP Gran Via" -3.74320,40.39540,"CA YSPP Los Carmenes" -3.77001,40.39237,"CA YSPP Madrid Av Poblados" -3.76139,40.38583,"CA YSPP Madrid Avda Los Poblados" -3.68722,40.42028,"CA YSPP Madrid C Alcala" -3.78917,40.39778,"CA YSPP Madrid Ciudad De La Imagen" -3.77861,40.39944,"CA YSPP Madrid Colonia Los Angeles" -3.78778,40.39917,"CA YSPP Madrid Colonia Los Angeles 2" -3.69380,40.41510,"CA YSPP Plaza Neptuno" -3.77820,40.40050,"CA YSPP Rotonda De Colonia Jardin" -3.69410,40.40650,"CA YSPP Sta Maria De La Cabeza" -5.76737,41.54444,"CA ZA N-630 Roales Entrada Alcolemia" -5.77130,41.55295,"CA ZA N-630 Roales Salida Alcolemia" -8.12120,42.30527,"CA ZALO A-52 Salida Ribadavia A-52" -3.46353,40.30597,"CA ZHUM Av Madrid Junto  Gasolinera BP" -3.66969,40.39751,"CA ZHUM Puente De Vallecas" -3.48855,40.31228,"CA ZHUM Tras Salida 22 Sent Valencia" -5.73879,41.47117,"CA ZIPI N630 Km 281.8 Dir Salamanca Control Alcoholemia" 2.62950,39.56663,"CA ZOLO Avenida Gabriel Roca" 2.65377,39.57587,"CA ZOLO Plaza De España" -3.71696,40.37378,"CA ZURK Madrid Av. De los Poblados" -3.71682,40.37318,"CA ZURK Madrid Calle de Tolosa" -6.39207,36.66850,"CA ZURR CA-604" -3.68360,40.43211,"CA ZURR VELAZQUEZ EMB ITALIA ALCOHOLEMIA" -6.40046,36.67777,"CA ZURRI ALCOHOLEMIA ROTONDA ENTRADA C BALLENA" 