-9.99999,1.11111,"CA   ROB USO COMERCIAL PROHIBIDO" -2.48472,43.18083,"CA 4MOT Av. De Otaola EIBAR" -2.48000,43.18056,"CA 4MOT Eibar Gi-2639" -2.53167,43.18250,"CA 4MOT N-634 Barrio De Areitio" -2.49000,43.17917,"CA 4MOT N-634 EIBAR" 2.02030,41.60204,"CA 7600 carretera de terrassa a Talamanca a la altura de la rotonda de mata" -3.77647,37.80673,"CA 80 CUST RAFA Dir. Jaen N 323" -0.78620,37.84524,"CA A951  N-332 Suelen montar Control de Alcohelemia la Guardia Civil los fi" -1.16224,38.02157,"CA A951 N-301 A" -1.16571,38.02643,"CA A951 N-301 B" -1.15924,38.01733,"CA A951 N-301 C" -2.28864,42.43677,"CA AAAA Salida AP-68 Agoncillo" -3.82332,37.78243,"CA AAES Jaen La Imora" -6.51653,40.59966,"CA AAGU Cl 515 Avda De Bejar. Ciudad Rodrigo" -6.53314,40.60927,"CA AAGU Sa 324" -0.65441,38.07638,"CA ABEL Rotonda N-332 Km 69.5 Ambas Direcciones GUARDARMAR DEL S" -8.52891,42.83649,"CA ABRG AG-59 Covas DIR La Estrada" -8.16403,42.67509,"CA ABRG N-525 A Laxe" -4.19360,39.96027,"CA ACOP Rielves" -2.99641,43.37470,"CA ADRI Getxo " -3.04606,43.31899,"CA ADRI Santurzi rotonda" -0.23850,39.65750,"CA ADRI V-23 DIR Ambas" -4.10398,36.75468,"CA ADSA Detras CC El Ingeniero Torre Del Mar" -5.94378,37.39292,"CA AGUS Calle fernandez murube a la altura del nº 12 aprox (Sevilla)" -2.41940,42.45003,"CA AHIE Crta Villamediana - Logroño" 2.11500,41.48537,"CA AIR- BP-1413 Sincroton" 2.21508,41.40463,"CA AIRT B-10  Besos Selva Mar" 2.19169,41.42127,"CA AIRT BCN Calle Berenguer Palou" -0.02258,40.97306,"CA AIRT CRUCE TE-710. N-420 .N-232" -3.57899,38.07137,"CA AJ-AJ Carretera De Linares A Úbeda. N-322 (Jaén)" 0.64260,41.11000,"CA AKLA  T-720 " 0.54805,41.22165,"CA AKLA Flix, Tarragona" -3.54574,39.96838,"CA ALBE via de servicio A-4, esplanada ITV (To)" -3.76982,40.26188,"CA ALEX M-419 Principio Fuenlabrada- Torrejon" -3.76939,40.26240,"CA ALEX M-419 Principio Fuenlabrada- Torrejon 2" -5.01125,36.47272,"CA ALRE Estepona En Atalaya-Isdabe Glorieta " -2.44427,42.46894,"CA AMOS Despues De La Cuesta" -2.36748,42.51443,"CA AMOS En El Descampado De Al Lado De Al Rotonda" -4.01977,39.94655,"CA AMUA Rtda Bargas DIR Olias" -5.93333,37.34444,"CA ANDO A-376 DIR Utrera surtidor Montequinto37" -5.95219,37.35708,"CA ANDO A-376 Sevilla DIR Utrera" -5.93778,37.38556,"CA ANDO A-92 DIR Granada entrada centro Transportes" -6.02667,37.35583,"CA ANDO S. Juan de Aznalfarache A-8058 en rotonda" -5.94633,37.40007,"CA ANDO Salida SE-30 Rodrigo de Escobedo" -5.95279,37.36096,"CA ANDO Sevilla A-376 con SE-30 DIR Madrid" -3.84222,43.40778,"CA ANRE Boo De Guarnizo Cantabria" -4.38747,36.72241,"CA ANTAS Control Policia Av. Pintor Sorolla DIR Malaga" -4.36883,36.72005,"CA ANTAS Control Policia C Bolivia DIR Almeria" -15.48792,28.09396,"CA ANTI GC-21 Las Palmas-Teror Alt Ciudad Del Campo" 2.15533,41.39974,"CA APEZ  BCN Travessera De Gracia Lugar Para Camion Basura" -3.85627,39.58200,"CA APLA CM-4017 Rotonda Entrada Los Yebenes Sabados Noche" -4.05833,39.86291,"CA ARCA Recinto Ferial Toledo" -4.02027,39.86331,"CA ARCAF Antes De Llegar A La Rotonda Viniendo Desde El Casco" -4.01701,39.90104,"CA ARCAF Control GC. Salida Dirección Bargas" -4.02508,39.86311,"CA ARCAF En La Parada De Taxis De La Vega" -0.46348,38.71559,"CA ARGU N-340 Gormaig" -4.00781,40.45323,"CA ARIO Calle Del Real Villanueva De La Cañada" -4.00010,40.41131,"CA ARIO Glorieta Olimpica Brunete" -4.05207,43.35844,"CA ARPL Torrelavega Rotonda De Sniace" 1.247642,41.272311,"CA ARUB N-240 km 17 en rotonda" -3.696053,42.32214,"CA ATLA BU-800 Paseo Pisones FINDES" 2.08975,41.35404,"CA ATRE Sal.15 Ronda Dalt Direcc. C32" -3.38998,38.90510,"CA B041 A-4/E5 Dir Manzanares" -4.51147,36.61249,"CA B041 control cinturon policia local El Pinillo-" -4.58879,36.57298,"CA B041 control diurno policia local Carvajal" -4.60085,36.56522,"CA B041 control diurno policia local Torreblanca-01" -4.60385,36.56393,"CA B041 control diurno policia local Torreblanca-02" -4.53602,36.58251,"CA B041 control diurno policia local Torrequebrada" -4.48456,36.65656,"CA B041 Cruce Churriana" -4.53676,36.59332,"CA B041 diurno policia nacional Arroyo de La Miel" -4.52144,36.59453,"CA B041 diurno policia nacional Benalmadena-Costa" -4.54049,36.60743,"CA B041 Esso" -4.54285,36.60681,"CA B041 guardia civil Arroyo de La Miel" -4.45836,36.69941,"CA B041 M-40 incorporacion." -4.24405,36.71246,"CA B041 policia local Benagalbon" -4.53434,36.60685,"CA B041/trn- diurno Arroyo de La Miel-" -4.51906,36.60051,"CA B041/trn- diurno Benalmadena-Costa-" -4.51589,36.59722,"CA B041/trn- diurno pl Benalmadena-Costa-" -4.52485,36.60223,"CA B041/trn- diurno pn Arroyo de La Miel-" -4.47561,36.67604,"CA B041/trn- guardia civil Malaga-" -4.69128,36.55340,"CA B041/trn- guardia civil Mijas-" -4.48855,36.64866,"CA B041/trn- las dos carreteras Torremolinos-" -4.46202,36.68749,"CA B041/trn- Malaga-" -4.46286,36.68124,"CA B041/trn- Malaga-" -4.47697,36.65531,"CA B041/trn- masivo año nuevo redonda plaza mayor Malaga-" -4.48173,36.64976,"CA B041/trn- masivo año nuevo redonda plaza mayor Torremolinos-" -4.52674,36.59081,"CA B041/trn- p.local Benalmadena-Costa-" -4.54081,36.58810,"CA B041/trn- p.local docum Benalmadena-Costa-" -4.53301,36.58566,"CA B041/trn- p.local docum Benalmadena-Costa-" -4.52468,36.59210,"CA B041/trn- p.local docum Benalmadena-Costa-" -4.52648,36.59484,"CA B041/trn- p.local docum Benalmadena-Costa-" -4.59312,36.57010,"CA B041/trn- p.nacional Carvajal-" -4.54139,36.58783,"CA B041/trn- p.nacional docum Benalmadena-Costa-" -4.52920,36.59572,"CA B041/trn- p.nacional docum Benalmadena-Costa-" -4.61621,36.55828,"CA B041/trn- p.nacional docum tras el camu Los Boliches-" -4.51016,36.60647,"CA B041/trn- p.nacional Torremolinos-" -4.51460,36.60166,"CA B041/trn- Torremolinos-" -5.71724,43.32242,"CA BABAR LANGREO-VILLA ASTURIAS 1" -5.73121,43.32644,"CA BABAR LANGREO-VILLA ASTURIAS 2" -5.53056,42.57389,"CA BAKO N-601 con CV-162-6" -8.57357,42.84924,"CA BALC N-550 Rotonda Milladoiro" -6.21179,36.45972,"CA BARL Pery Junquera Rotonda DIR Todas" -5.75349,40.06881,"CA BARR EX-203 Dir Jarandilla De La Vera." -5.75774,40.05433,"CA BARR EX-203 Jaraiz Frente Estacion Autobuses" -5.74744,40.05745,"CA BARR EX-392 Ctra Jaraiz Frente Cementerio" 2.08052,41.34598,"CA BCN9 A-2 Km 610 DIR Ambas" 2.08727,41.36428,"CA BCN9 Alvarez de Castro DIR Ambas" 2.10356,41.35806,"CA BCN9 Av Carrilet 311 DIR Centro" 2.19592,41.38715,"CA BCN9 Av Litoral Hotel Arts DIR NE" 2.11599,41.36998,"CA BCN9 Av. Torrent BCN" 2.15298,41.43652,"CA BCN9 Avinguda de l-Estatut de Catalunya BARCELONA" 2.12327,41.37600,"CA BCN9 Avinguda de Madrid BARCELONA" 2.14607,41.34972,"CA BCN9 Barcelona Rda Litoral" 2.82653,42.03110,"CA BCN9 C-66 DIR Ambas" 2.11904,41.37925,"CA BCN9 Cardenal Reig " -1.70830,38.53605,"CA BCN9 CM-313 Rotonda" -1.74311,39.42878,"CA BCN9 CM-3222 Iniesta GC DIR Ambas" -1.71573,39.35975,"CA BCN9 CM-3222 Ledaña GC DIR Ambas " -1.80142,39.23174,"CA BCN9 CM-3222 Madrigueras" -2.10325,38.44919,"CA BCN9 CM-412 DIR Ambas" -1.744181,38.48991,"CA BCN9 CM-412 Km DIR Ambas" -1.58611,38.56080,"CA BCN9 CM-412 Tobarra" 2.15972,41.38125,"CA BCN9 Compte Urgell 41" 2.10718,41.35334,"CA BCN9 Entre Rambla Marina y Trav. Ind." 2.11263,41.34738,"CA BCN9 Final Rbla Marina con Antig. Crtra Prat" 2.20947,41.42088,"CA BCN9 Gran Via dl Corts Cat. 1167 DIR Centro" 2.14509,41.35167,"CA BCN9 GU Passeig Zona franca DIR Puerto" 2.20916,41.42561,"CA BCN9 Guipuscoa DIR Centro" 2.21882,41.40661,"CA BCN9 Josep Pla Sobre Rda Litoral" 2.11458,41.36588,"CA BCN9 Josep Tarradellas DIR Ambas" 2.08801,41.37746,"CA BCN9 N-340 Esplugues" 2.07983,41.31699,"CA BCN9 Once de Septiembre" 2.14473,41.36728,"CA BCN9 Plaza Montjuich DIR Ambas" 2.13115,41.43161,"CA BCN9 Rabassada DIR Ambas" 2.08350,41.31734,"CA BCN9 Sant Cosme Prat de LL" 2.13143,41.36822,"CA BCN9 Sta Eulalia 1 DIR Ambas" -0.19108,38.92370,"CA BELG Beniflá, (VALENCIA)" -0.19428,38.95174,"CA BELG Toni, Gandia, (Valencia)" -1.45860,38.04143,"CA BENJ Mula Mu" -2.19776,40.08379,"CA BERM Autovia Fines De Semana Cuenca" -2.14718,40.04034,"CA BERM Carretera Del Alcazar Cuenca" -2.20716,40.08330,"CA BERM N-320 Debajo Autovia Cuenca" -2.12239,40.05050,"CA BERM N-320A Fines De Semana Cuenca" -5.64004,37.49108,"CA BERT A-457 km 0.300 DIR Lora del Rio" -3.36566,40.46871,"CA BLAGA Alcalá De Henares 1" -3.36250,40.46944,"CA BLAGA Alcalá De Henares 2" 2.40922,42.24272,"CA BLAU C-26  Rotonda Catalunya" 2.32622,42.24652,"CA BLAU C-26  Rotonda Catalunya" 2.49794,42.20181,"CA BLAU C-26  Rotonda Entrada Olot Catalunya" 2.49753,42.20790,"CA BLAU C-26  Rotonda La Canya Catalunya" 2.36556,42.25963,"CA BLAU C-38  Sant Pau Seguries Catalunya" 2.36197,42.31575,"CA BLAU Rotonda  Camprodon Catalunya" 0.47129,40.47977,"CA BLOM N-340 Vinaros" -3.73444,40.41750,"CA BNCR Casa Campo Gta Patines" -6.82978,37.28309,"CA BOBY A-494 KM 5.700" -6.83196,37.26932,"CA BOBY HU-3110 KM 0" -2.53915,41.470921,"CA BONP CL-116 Km CL-110 Dir Ambas" -0.87053,41.68955,"CA BRAD En Rotonda Direccion Huesca" -5.96639,43.56556,"CA BRKI Asturias Glorieta De Salinas A Piedras" -5.79833,43.43722,"CA BRKI Asturias Media Y" 2.26778,41.62389,"CA BRNY en rotonda C-17 BV-1439" -3.81364,40.27409,"CA BUSE En Rotonda Junto A Gasolinera. Fuenlabrada Madrid" -3.84350,40.26379,"CA BUSE Fines De Semana. GLORIETA BAJO LA M-407. Moraleja De Enm" -4.74307,41.68066,"CA BUTT Ctra. Fuensaldaña Rotonda DIR Todas" -8.66821,42.43329,"CA BYBA Ambos Sentidos" 1.57284,41.19326,"CA c-31 Carretera de Santa Creu de Calafell" -1.22361,37.99576,"CA CA84 Aperitivos Hernandez.Sta Barbara.JavaliNuevo.MU" -1.20669,37.97329,"CA CA84 Frente Hero C/Mayor Alcantarilla.MU" -1.21002,37.97671,"CA CA84 Frente Meson la Rueda.Alcantarilla.MU" -1.11700,37.99074,"CA CA84 Hotel Nelva.Entrada Atalayas.MU" -1.22211,38.01015,"CA CA84 Petronor.N-344 de Las Torres a Alcantarilla" -1.22533,37.96237,"CA CA84 Puerta Renault Sangonera Seca.MU.N340A" -0.82355,37.77528,"CA CA84 Rotonda Aeropuerto San Javier.MU" -0.83505,37.76312,"CA CA84 Rotonda CC Las velas.Narejos.MU" -0.83807,37.78904,"CA CA84 Rotonda salida N-332.MU" -4.89845,40.60167,"CA CAL N-110 Muñogalindo Fines De Semana" -2.22610,41.24456,"CA CALA A-2 Vía de servicio" -2.29046,41.21649,"CA CALA A-2 Vía de servicio Arcos" -3.95572,39.68446,"CA CALA Camino Vilaminaya Orgaz" -3.94055,39.66898,"CA CALA CM-410 Poligono Fuente techada" -2.17843,41.26874,"CA CALA Crtra. De la N-II" -2.19115,41.25710,"CA CALA Crtra. De la N-II Rest. El Campo" -2.42082,41.17194,"CA CALA N-111 Medinacelli" -3.97365,39.68731,"CA CALA N-401 Sonseca" -3.98261,39.72103,"CA CALA N-401a Ajofrín" -15.70893,27.79874,"CA CANA Rotonda Puerto Rico-" -3.64003,38.13193,"CA CANO en A-303 acceso camino La Cruz" -5.70278,40.96287,"CA CAPA A-62 Salida Km 243 El Marin" -6.51674,40.61412,"CA CAPA Ciudad Rodrigo SA" -5.65622,40.99796,"CA CAPA CL-519 Salamanca" -6.53743,40.58271,"CA CAPA CL-526 Ciudad Rodrigo (SA)" -6.002954,37.36071,"CA CARL Sevilla Ctra de la esclusa " -1.10789,38.00394,"CA Casillas MU" 2.18389,41.49075,"CA CEOS Fin De Semana Parada Bus" 2.03640,41.50667,"CA CHAR BP-1503 Km 18.7 Rubí Rotonda" -2.27296,43.17970,"CA CHAR Esclavas Azpeitia Guipuzkoa" -2.25884,43.19122,"CA CHAR Eskista Azpeitia Guipuzkoa" 2.00285,41.54958,"CA CHAR Rotonda N-150 con C-243C" -3.63751,40.46914,"CA CHEM Madrid-C/Arequipa" -5.10462,37.71085,"CA CHIV  Peñalosa Andalucia" -4.51125,41.99126,"CA CHPS  Av San Telmo Palencia" -4.55845,42.07457,"CA CHPS  CL-615 Grijota" -4.53470,42.01402,"CA CHPS  Palencia Plaza Leon" -4.52832,42.00305,"CA CHPS  Palencia Rotonda Av Valladolid" -4.50889,41.95262,"CA CHPS P-900 Villamuriel De Cerrato" -4.55948,42.03591,"CA CHPS Palencia Rotonda CL-615" -4.04811,43.34640,"CA CHRT CA-131 Cerc Fabrica Solvay" -4.03972,43.41379,"CA CHRT CA-132 Cerc Calle Del Mayor" -4.06845,43.42046,"CA CHRT CA-351 Cerc Calle Del General" -5.95660,36.97680,"CA CIPO A-471" -4.46656,36.68020,"CA CIRI madrugada en fines de semanas (MA)" 0.03750,38.65361,"CA CLEM N-332 Calpe en gasolinera BP" -4.43002,36.89609,"CA COBO Casabermeja" -4.22734,36.71333,"CA COBO N-340A Salida Autovia Del Meditarraneo - Direccion Almeria" -3.81841,43.46495,"CA COCOPC  Paseo Del General Dávila 260 Meteorologico" -3.84834,43.42127,"CA COCOPC Avenida De Bilbao Embutidos Jose Guardia Civil" -3.81836,43.45548,"CA COCOPC Calle Castilla Policia Municipal" -3.83100,43.45073,"CA COCOPC Detras De Vidal De La Pena Candina" -3.81234,43.46168,"CA COCOPC El Champion Calle Burgos" -3.82762,43.45182,"CA COCOPC Enlace De La Marga" -3.79316,43.47236,"CA COCOPC Glorieta Los Delfines" -3.86142,43.43802,"CA COCOPC N-623 Bajo Puente A-67 Guardia Civil Ambas DIR" -3.81753,43.46107,"CA COCOPC Plaza De Numancia" -3.80563,43.46021,"CA COCOPC Plaza Farolas" -3.83258,43.45617,"CA COCOPC Rotonda Bomberos" -3.82919,43.45385,"CA COCOPC Rotonda La Marga Salida Del Poligono" -3.83018,43.46103,"CA COCOPC Rotonda Los Osos" -3.81959,43.46031,"CA COCOPC San Fernando Salida Tunel" -3.81422,43.46161,"CA COCOPC Tunel Burgos Dentro" 2.77514,39.56870,"CA COLI Carretera de Palma a Manacor sentido Palma" -3.712079,40.47025,"CA COMP Camino del Chorrillo" -3.697522,40.54091,"CA COMP Entrada UAM" -3.84510,40.35075,"CA CONQ N-V Hacia Hospital Alcorcon" -4.11802,40.29872,"CA CONQ Rotonda M507 Dir Aldea Del Fresno" 2.07278,41.37541,"CA COPR BCN sal B23 San Just dir BCN" 2.07251,41.37781,"CA COPR BCN sal B23 San Just dir Molins" -7.27316,43.56244,"CA COPR Lugo entrada Foz" -7.34287,43.47794,"CA COPR Lugo Masma alcoh y documentacion" -7.28554,43.58518,"CA COPR Lugo salida Foz" -7.00944,37.26444,"CA CRIC KAPE Rotonda Entrada Aljaraque (Huelva)" -3.52260,40.38156,"CA CRIS Cristo De Rivas" -0.39647,39.38688,"CA CRIS CV-33 Albal DIR SW" -6.61009,40.02919,"CA CRIS EX_A1 Rotonda" -6.37801,39.47212,"CA CRIS Gral Primo de Rivera" -4.02167,43.39127,"CA CRIS N-611 Boo Rotonda" -5.67963,38.74636,"CA CRIST Entrada a Quintana de la Serena fines de semana y festivos a parti" 2.14874,41.50503,"CA CRST B-141 Crt Santiga Ripollet" 2.11769,41.48592,"CA CRST Crt D Cerd - S.Cugat" 2.15520,41.49445,"CA CRST Entrd O Salid Ripollet" -4.37033,40.06147,"CA CSAR Maqueda" -3.67288,40.43224,"CA CUCU Madrid Juan Bravo 66 laborables" -3.66936,40.41840,"CA CURI C/Doctor Esquerdo" -5.95694,36.25389,"CA CUST A-293 Hacia Barbate A La Altura De La Barca De Vejer" -4.17374,40.15818,"CA CUST A-5 En Salida 52. Control Policial" -4.10262,40.20709,"CA CUST A-5 Salida 43 Hacia Valmojado-Mentrida. Control Policial" -5.54885,37.65096,"CA CUST ALFO. Ambos Sentidos (A-436)" -3.61639,40.67889,"CA CUST AMAT Normalmente Por La Tarde. San Agustin De Guadalix" -0.25166,39.07694,"CA CUST ANDR Tavernes De La Valldigna" -2.11169,43.09646,"CA CUST ARBU N-I Dir.Madrid" -1.91278,43.31694,"CA CUST ARRA N-I Dir. Irun" -1.77806,43.34083,"CA CUST ARRA N-I Dir. Madrid Control Documentaciones" -3.83435,40.42397,"CA CUST ATIL En Isleta Incorporacion De M-503 A M-40" -3.58861,40.21538,"CA CUST AUXT Plaza Av. Doctor Manuel Jarabo. Piden Papeles" -4.54312,36.60685,"CA CUST B041 Control Documentos Diurno Guardia Civil" -4.54985,36.58111,"CA CUST B041 Control Documentos Diurno P.Local Y Nacional" -4.99289,36.49449,"CA CUST B041 Entrada San Pedro Desde Ronda" -0.05502,39.94421,"CA CUST BERE CV-18/CV-183 Control Alcoholemia" -0.07969,39.95361,"CA CUST BERE CV-1870 Control Alcohol En Cruce" -2.41556,42.49056,"CA CUST BHST A-13  PK.5 Ambas Direcciones" -2.45030,42.46414,"CA CUST BHST Control Alcoholemia.Policia Municipal" -2.44772,42.46420,"CA CUST BHST Control Alcoholemia.Policia Municipal" -2.34161,42.44963,"CA CUST BHST N-232 Ambos Sentidos. Alcoholemia y Documentacion" -2.35367,42.45029,"CA CUST BHST N-232 Contro para disminuir a 20km/h Ambos Sentidos" -2.39877,42.45916,"CA CUST BHST N-232 en carril de deceleracion salida 1" -2.45371,42.46261,"CA CUST BHST Policia Municipal. Calle chile 15" -3.35476,39.00337,"CA CUST BOIN G.Civil Alcoholemia Y Documentacion" 1.64630,41.57157,"CA CUST BR C244 - En Isletas Y Semaforo" 1.65719,41.57710,"CA CUST BR NIIa - Nueva Rotonda" 1.61689,41.58903,"CA CUST BR Pasado Concesionario Opel - Dir. Lleida" 1.63988,41.57846,"CA CUST BR Rotonda - Gasolinera Petronor" 1.53920,41.60419,"CA CUST BR Rotonda A-2 - Salida Calaf - Andorra" 1.97141,41.46799,"CA CUST BR Rotonda Castellbisbal" 1.69353,41.52188,"CA CUST BR Rotonda Cerca Capellades" 1.66879,41.57989,"CA CUST BR Rotonda Final C-15" 1.64870,41.57805,"CA CUST BR Rotonda Hisitex" 1.75002,41.52624,"CA CUST BR Rotonda Piera" 1.54027,41.70241,"CA CUST BR Rotonda Prats De Rei" -3.78113,39.65998,"CA CUST BRAV CM-42 Salida 27 En Rotonda.Fines Semana Y Festivos" -2.35022,42.44971,"CA CUST BSHT Control Alcoholemia" -0.45653,39.48951,"CA CUST CARC Avenida Del Pais Valenciano 15. 16" 2.20887,41.45825,"CA CUST CARL Avda. Pallaresa. Santa Coloma de Gramenet" 2.72771,41.64238,"CA CUST CARL Avda.de la Costa Brava. Malgrat del Mar" 2.21788,41.45141,"CA CUST CARL Rambla del Fondo. Santa Coloma de Gramenet" -1.74819,42.86716,"CA CUST CARM AP15 Autopista de Navarra. Sentido Pamplona." -1.74831,42.86806,"CA CUST CARM AP15 Autopista de Navarra. Sentido Vitoria." -2.41665,42.47197,"CA CUST CARM Pol.Cantabria 1 - En Rotonda" -2.41592,42.47197,"CA CUST CARM Pol.Cantabria 2 - En Rotonda" -2.41592,42.47253,"CA CUST CARM Pol.Cantabria 3 - En Rotonda" -2.41665,42.47253,"CA CUST CARM Pol.Cantabria 4 - En Rotonda" -4.29878,36.72338,"CA CUST CFLO Entrada Rincon De La Victoria" -5.14847,36.72428,"CA CUST CHEM A-376 Ronda-San Pedro Alcantara Rotonda" -5.14869,36.75356,"CA CUST CHEM Ronda. Rotonda De Entrada Ronda Este" -5.18479,39.92630,"CA CUST CM-5150 Control Guardia Civil" -3.82660,40.30071,"CA CUST Control Alcoholemia" -4.12358,40.15979,"CA CUST Control Alcoholemia entrada y salida pueblo" -5.75319,43.39127,"CA CUST Control Alcoholemia." -5.75771,43.38312,"CA CUST Control Alcoholemia. Fines De Se" -6.54454,43.19450,"CA CUST Control Alcoholemia. Fines De Se" -5.73816,43.38219,"CA CUST Control Guardia Civil." -3.82831,40.12503,"CA CUST Control Policial En Rotonda Junto BP" -3.80509,40.12254,"CA CUST Control Policial Guardia Civil" -3.99657,39.94489,"CA CUST Control Policial Salida De C.C. Puerta Toledo. CLAV" -3.92483,40.30164,"CA CUST Control Policial. Sobretodo Fines de Semanas" -0.83696,41.67148,"CA CUST COPI Av. De La Industria. Enfrente BALAY" -2.40078,43.22846,"CA CUST Corrige ENKO N-634 CALLE DE SAN ANTOLIN" -1.42472,37.85096,"CA CUST COYO Alhama de Murcia" -1.40931,37.83224,"CA CUST COYO MU-602 Almazara" -1.40390,37.85815,"CA CUST COYO N-340a Gines Campos" -8.35788,42.91083,"CA CUST CRX - Arca - O Pino - CLAV" -8.50725,42.68650,"CA CUST CRX N-640 Km 206.1 - A Estrada-Pontevedra.CLAV" -3.91004,41.25676,"CA CUST DEME Cantalejo Salida Hacia Cuellar.Solo En Fiestas" -3.93409,41.26239,"CA CUST DEME CL-112 Cantalejo-Segovia.Solo En Fiestas" -3.95606,41.39304,"CA CUST DEME CL-603 Segovia Cruce Con Sacramenia.Solo Fiestas" -3.66065,40.40904,"CA CUST DEME Corregidor Diego Valderrabano, 13" -3.65877,40.41397,"CA CUST DEME Doctor Garcia Tapia. 23" -3.75943,41.29425,"CA CUST DEME Sepulveda SG-232 Cruce SG-2323.Fines Semana" 2.20692,41.43641,"CA CUST DEY Martes De 10H A 15H" -3.40806,38.76722,"CA CUST DINA CM-412 Control Alcoholemia Fines Semana Noche" -4.02713,40.27921,"CA CUST En Rotonda Incorporacion A-5. Control Policial" -3.86976,40.21202,"CA CUST En Rotonda Salida M-407. Control Policial.Visto Mañanas" -2.65621,42.87878,"CA CUST ENEK 5/355 (Vitoria Gamarra)" -2.66990,42.85180,"CA CUST ENEK Calle Francia 41 (Vitoria Gasteiz)" -8.74222,42.12778,"CA CUST EPIL PO-331" -8.79333,42.39833,"CA CUST FAUS En Lateral de PO-308 Dir.Pontevedra" -8.81306,42.41194,"CA CUST FAUS En Rotonda Acceso a AG-4.1/VG-4.1" -7.73906,42.83959,"CA CUST FAUS N-540 Dir. Lugo" -0.56699,38.19905,"CA CUST FL0R Ctra. De Elche Junto Camelot" -0.41503,38.41769,"CA CUST FL0R N-332 Cruce La Font Campello" -0.55891,38.19099,"CA CUST FLOR Av. Fernando Perez Ojeda" -0.66550,38.09625,"CA CUST FLOR Bajo Puente Acceso Guardamar Desde CV-910" -0.85950,38.08937,"CA CUST FLOR CV-910" -0.84932,38.08944,"CA CUST FLOR CV-910 ITV" -0.77181,38.09846,"CA CUST FLOR CV-914" -0.77136,38.09879,"CA CUST FLOR CV-914 - 740" -0.72373,38.25986,"CA CUST FLOR N-340" -3.53147,39.45736,"CA CUST FMSG Control G.C. Suelen Pedir Seguro. A V" -3.07880,39.12252,"CA CUST FMSG En Rotonda. Autovia Hacia Ctra. Ruide" -3.62417,40.38167,"CA CUST GIL C. Alcoholemia Noches Viernes Y Sabados" -3.62028,40.37611,"CA CUST GIL C. Alcoholemia Noches Viernes Y Sabados" -4.14579,38.70580,"CA CUST GORD CM-4110 Dir. Puertollano. Sobre Todo Findes" -2.99528,39.16222,"CA CUST HOTE CM-400. Control Alcoholemia" -5.65226,40.95121,"CA CUST JAB. En La Rotonda. Noches Sobre Todo Findes" -5.96972,37.33528,"CA CUST JALA Control Alcoholemia Solo Fines De Semana. CLAV" -5.06093,40.22151,"CA CUST JANT AV-923 Dir. La Parra. Casi todos dias 20:00 a 21:30" 0.42699,40.42377,"CA CUST JLMC N-340 Dir.Valencia-Barcelona.Benicarlo.CLAV" -3.67400,40.19528,"CA CUST JOLU A la Salida del Puente en la Rotonda" 2.18276,41.38835,"CA CUST JORG C/Pujades-Picasso. Por las Mañanas. BCN" 0.40861,40.39333,"CA CUST JRVB CV-140/CV-1401 En Rotonda" 0.46472,40.46861,"CA CUST JRVB N-340 En Cepsa Ambos Sentidos" -8.72693,42.28746,"CA CUST LECH Ambos Sentidos" -8.78439,42.28952,"CA CUST LECH En Gasolinera" -8.68769,42.40103,"CA CUST LECH Entrada En Marin" -8.66243,42.29176,"CA CUST LECH Entrada Via Rapida" -8.77026,42.26320,"CA CUST LECH Frente A Keniata" -3.69309,40.34507,"CA CUST LEO Bajo Puente Entrada A San Cristobal.CLAV" -3.88625,40.33511,"CA CUST LEO Ctra Villavic-Mostoles" -3.70161,40.30450,"CA CUST LEO Glorieta (Getafe). CLAV" -6.52973,42.69345,"CA CUST LOLE CL-631 - Toreno" 2.18720,41.39498,"CA CUST MANR Av. Meridiana" -3.60313,40.68980,"CA CUST MANR Avda Aaronxu Rotonda" -3.71040,40.31210,"CA CUST MANR Avda Juan Borbon" -3.61234,40.67262,"CA CUST MANR Avda Madrid" -3.74530,40.37426,"CA CUST MANR Avda Poblados" -3.70840,40.33940,"CA CUST MANR Avda Real De Pinto" 1.16557,41.89422,"CA CUST MANR C-14" 2.03088,41.47449,"CA CUST MANR C-1413" 2.02025,41.46672,"CA CUST MANR C-1413" 2.24117,41.88221,"CA CUST MANR C-17" 2.23752,41.85487,"CA CUST MANR C-17" 2.24499,41.77519,"CA CUST MANR C-17" 2.15815,41.42532,"CA CUST MANR Calle Llobregas" 1.01484,41.63168,"CA CUST MANR Ctra De Madrid A Francia" 0.91416,41.63002,"CA CUST MANR Ctra De Nacional II" -3.69153,40.44638,"CA CUST MANR Joaquin Costa" 0.26333,41.86568,"CA CUST MANR N-240" 1.35922,41.14799,"CA CUST MANR N-340" 2.15649,41.42986,"CA CUST MANR Pza Rafael" -3.69770,40.33950,"CA CUST MANR San Dalmacio" -3.69130,40.45920,"CA CUST MANR Sor Angela De La Cruz" 1.53793,41.19597,"CA CUST MANR TV-2127" 0.61375,40.71236,"CA CUST MANR TV-3454" -9.04167,42.78837,"CA CUST MANU AC-550 Control Alcoholemia" -9.05778,42.76139,"CA CUST MANU AC-550 Control Alcoholemia" 2.16318,41.53390,"CA CUST MART B-140 Mossos D Esquadra" 2.16452,41.54216,"CA CUST MART B-142 Control Policia Local Polinya" 2.15986,41.54772,"CA CUST MART B-142 Control Policia Local Polinya" -5.99977,37.66083,"CA CUST MGM A-8002 en Rotonda. Findes. CLAV" -5.98672,37.51391,"CA CUST MGM en Rotonda. Findes. CLAV" -5.77926,43.23010,"CA CUST MIER AS-242 Interseccion de la Reguerona.Domingos 3 AM" -5.82571,43.16531,"CA CUST MIER Salida Pola de Lena Parte Superior Puente. Findes." -3.79835,40.43501,"CA CUST MIES" -3.78229,40.44044,"CA CUST MIES 2" -1.42049,37.84421,"CA CUST MOOR Red.Via Mu-602 Alhama De Murcia" -5.44223,43.48702,"CA CUST N-632 JO33 Villaviciosa" -8.52998,42.85423,"CA CUST NANO N-525" -8.47743,42.80685,"CA CUST NANO N-525 Dir. Santiago de Compostela-Ourense" 2.10710,41.38298,"CA CUST NAPO BCN" 2.11232,41.38357,"CA CUST NAPO BCN" -3.66485,40.16411,"CA CUST NCTF Control Policial N-404 En Rotonda Puente N-IV. CLAV" 2.30966,41.59653,"CA CUST NENE C-1415. Varias veces por mes" 2.20391,41.45398,"CA CUST NOMI Av. Pallaresa" 1.95962,42.23991,"CA CUST NOMI B-402" 2.03502,41.53287,"CA CUST NOMI BP-1503" 1.12018,41.13643,"CA CUST NOMI C-14" 1.13039,41.08979,"CA CUST NOMI C-31B" 1.14378,41.07688,"CA CUST NOMI C-31B" 1.09641,41.65382,"CA CUST NOMI C-53" 2.18063,41.59888,"CA CUST NOMI C-59" 2.22639,41.45920,"CA CUST NOMI Calle Dinamarca" 2.09091,41.35630,"CA CUST NOMI Calle Sicili" 2.02827,41.39485,"CA CUST NOMI Hospitalet" 1.92812,41.26397,"CA CUST NOMI Sitges" 2.73087,41.70219,"CA CUST NOMI Tordera" -4.66114,37.59002,"CA CUST PADI Ambos Sentidos. Salida Montilla. CLAV" -3.86034,40.32745,"CA CUST Policia Local. Normalmente Tardes." 0.89838,41.64453,"CA CUST PONS Rotonda Iveco" 1.04756,41.79163,"CA CUST PONS Rotonda Preixens" 2.44722,39.54361,"CA CUST R25V Control de Drogas y Alcoholemia" -4.04617,38.01125,"CA CUST RAFA A-311 Motoristas" -3.81699,37.80686,"CA CUST RAFA A-311 Motoristas" -3.13230,37.91869,"CA CUST RAFA A-319 Cazorla-Torreperogil. Control Policial" -3.76180,37.79461,"CA CUST RAFA Dir. Jaen-Torrequebradilla" -3.77038,37.78738,"CA CUST RAFA Dir. Jaen-Torrequebradilla2" -3.77741,38.02378,"CA CUST RAFA Dir. Javalquinto-Bailen" -3.77265,37.81610,"CA CUST RAFA Direccion Bailen-Jaen" -3.77676,37.80642,"CA CUST RAFA Direccion Bailen-Jaen E 902" -3.41360,38.01334,"CA CUST RAFA Direccion Jaen Ubeda A-316" -3.74741,37.77867,"CA CUST RAFA Direccion Jaen-Ubeda" -3.38669,38.01382,"CA CUST RAFA Direccion Ubeda A-316" -3.56581,37.40645,"CA CUST RAFA En Rotonda Dir Almeria A-308" -3.77778,37.79013,"CA CUST RAFA Granada-Ubeda N 323 En Salida Curva" -3.33845,40.64710,"CA CUST RAUL" -3.33712,40.63267,"CA CUST RAUL" -3.63056,40.37639,"CA CUST RIV Alcoholemia Noches Viernes Y Sabados. Muy Habitual" -1.92232,38.96936,"CA CUST RUBI N-322a" 